1,' Kamar patli jitni utna hi zyada mazaa hai '' This while Salman grabbing Zareen Khan ' s waist ! Character Dheela
1,' Usse taraash ke heera bana diya hum ne Faraz / Magar ab ye sochte hain usse hum kharidein kaise ' shair
0,""" Sanchita Banerjee Sanchita Banerjee Bhojpuri Beautiful Beauty Bollywood India Star Girl "" Bhojpuri _ Magicpic . twitter . com / ym WP Zqa We R"
0,""" so rahe ho "" puch ke uthane walo ko Triple Talaq dena allowed hai ."
0,* Mahabharat * Arjun tumhe kya dikh raha hai ? A - Machli ki aankh * Bollywood * Arjun tumhe kya dikh raha ha ? A - Shraddha ki .. aankh
0,", Pak politics mein Loha garam hai aj kal , is baar kuch na kia to agey bhi ap se kuch nahin hona . Mr Canada ."
0,. aaj aap ne toh lajwaab innings khela ... KING _ OF _ CRICKET
1,.. Desh aage badh raha hain toh Kya gas cylinder ka price aage naa badhe .. garibo Ki Sarkar
0,: Yaal - Pannai Kadatparappil Padahonru Kavilnthathil Oruvar Pali ; 6 Per Hospitalil CRICKET S Lv IND SL 236/8(50) Malayinaal Poatti Thaamatham
0,100% mat bolte ja beta 50%50 bolte ja Q ke ye tumse na ho payenga beta cricket me prediction krne wale kahi aaye aur side me chale bhi gaye
0,2 months of no cricket for me ... par abhi bhi Rohit ko open krte hue dekh dil dhak dhak hone lgta h
0,20 sal tu ne naukari ki tab to tune ye video nahi dala jab VRS dae diya tab politics main ane kae liye tune ye sab kiya
0,4 saal se mai jab bhi bollywood actor banne ki baat sochta hun to koi na koi chhik deta hai ya fir light chali jaati hai
0,5 th ODI :10 number jersey pehen ne se tendulkar ban jate to baat hi kuch aur thi . Indvs SL
0,70 saal phle aur ab .. kewl politics hi hota rahega ... isse jyada kuch intense Nhii
1,"Aaj dhoni ko god , magic man bolnewale kabhi usiko gaali de rahe the .. Roflol !"
0,Aaj ke din toh politics mat kariye !! Isiliye congress ka ye haal hai
0,Aaj sale fielding bhi achhi krenge ... Puri cricket aaj hi khel loge Chutiyo Indvs SL
0,"aajkal koi nahi puchhta Kapoors ko ,, tabhi Khan ' s ka Raaj hai Bollywood mein Public ne nakar Diya ab chhod do nautanki"
0,Aakash ji plz purnai tasvire share Kiya Karo . hame bhi acha lagta hai aapke purane photo dekha .. Cricket
1,aap bhi to Aam aadmi party n aam apradhi party mein fark mita rahe ho . AA Ptards
0,"AAP Ek apeel ye bhi kar dete ki kripya Hindu mujhe vote na den ., Tab hoti Different Politics ."
0,Aap ko Ik ne party me shamil nahi Kia Jo k aap ki bharpoor koshish thi yehi wajah thi k Ik ko family politics Pasand nahi
0,Aap logo se bahut ummid hai . Jaan maal ka nuksan na ho or shaanti bani rahe . Vote ki politics baad mai bhi hogi .
0,Aap triple Talaq isliye Bachana Chahte Hain Ki Bahu Bhi baat kar sakte anginat bacha Paida Kare awadi Barhawe
1,Ab kaun aajkal aise twitter mein bhi darshan dete hain ?! ki tarah ! Hum dhanya hue !
0,Abhi Bollywood wale chup rahenge . Unka janwar pyar kam ho jayega . Dawood bhaiya naraz ho jayenge
0,Abhi tak cricket me hi pade ho 2050 tak ek hi jeet celebrate karna
0,abhi tak ye baat samajh main nahi aai triple talaq musalmano k liye ban lekin khush hindu and media ho rahain hain
0,Abhi toh Nawaz Sharif Politics shru hui hai abhi picture baki hai Dost Dost na raha Ab toh Zardari bhi Nawaz ka dost nahi raha
0,Acha aunty triple talaq ke baare mein kuch bolo .. aur halala nikah ke baare mein bi batao
0,acha triple talaq ka mudda aastha se jyda h cow ka mudda aastha se nhi juda ... waah re waah
0,Achche hua cricket mai politics nhi hai varna congress kahti ki pakistan ko harane se kuch logo ki dharmik bhavnaye ............ hoti hai .
1,Achha ghamnd usko hai !!!!
0,Achha hota yadi cricket se jiyada annya khelon par diyan diya jaye
1,Achhe Din aa to gae hai par kohre ki wajah se dikh nhi rhe shyd Modi Modi Bhakts height india pm New Year With Goeventz
1,"After singing National Anthem what we see is , "" Iss Sehar ko ye hua kya ,, Kahi raakh he ,, to kahi Dhua Dhua !!"""
0,Agar Ladki Ulti Karti Hai To uska ek hi Karan mana jata hai Ki Woh Pregnant Hai ! Bollywood
1,"Agar Musalman Qaum ek ho ke Dua karay aur agar Allah ki marzi ho to Inshallah , Alhamdulillah Manchester United Zaroor Jeetay Ga ."
0,Agar politics par baat karna nahin ati .. tu ghatya baat bhi na karo Warna bhoat kuch sunanay ko milay gha
1,Agar Salman Khan to jail ho jati toh mera paison se vishwas uth jata . ;-
0,Agar sharm nam ki chij hoti to politics nhi hota ispar ..!!
0,Agar yahi chlta rha ... to BOLLYWOOD Ka future khatre mein hai
1,Agarbatti 2 types ki hoti hai ek bhagwan k liye aur ek machhar k liye but syapa yeh hai ki bhagwan aate nahi aur machhar jaate nahi
0,Air survey chor kar Jo log bhuk pyas se marr rhe hai unko to dyan diya jayega ya bss isme vhi politics khela jyega .... kuch kijiye ... pic . twitter . com / Bv Tv F 6 DK 88
0,Allah ke naam par politics karate hain Janab . Allah Ke naam par Babar ne masjid banai . Uske oahle yo ram Mandir tha .
0,Ameen . Jab ap jaise qabil lug politics main ayen ge tu insha Allah asa jald ho jae ga
1,"Angelo Mathews be like "" Itni khushi to hamain jeet kr nahi hui jitni Pakistanio ko India ki haar ki hui """
0,anuragbhadoriya ji aap log ke upar dhikaar hai politics liye kuch bhi bech sakte ho yaar .... soch aisa rakho maa or mulk ek hai
0,"Apt song for u Today . Tum itna q muskara rahe ho , kya gum hai jisko chupa rahe ho ? Triple Talaq"
0,Are ek bar hamare hawale kr k to dekho .... fr dekho Bharat kaise badalta hai bt hr koi Janta hai yha v politics hogi
1,Arey jaan loge kya bacchi ki ? kitna he antar hai hind desh k niwasi gane main aur jana gana mana main 19-20 ka toh antar hai !
0,Ary bhai kaha khara hua ha Ese he Politics me ana asan kaam ha
0,Assalam Alykum bhaijaan kaise ho aap mujhe aapke saat cricket khelna hai
1,at its best . Jisko bachana chaha wahi jaan lene pe aa gye Kanhaiya Kumar
0,Atankwadi bhaiyo ko 2 din chutti pe bhejdo is bar kuch hua to Pak ke saath Keniya bhi nahi khelega But good to see cricket back in pak
0,Aur aaj jaan buj ker khanoon ko challenge karte hue yeh kaam kiya yeh hai Rss ki politics aur niyat
0,Aur kitne ache din chahiye Ram Rahim Verdict Triple Talaq Right To Privacy
1,"aur kyaa kahun , chhoti moti chori - rishvat khori deti hai apana guzara yahan aap ki dua se baki thik thak hai .. Bharat Bandh Bandh"
1,Aur mere hisaab se ' Laxman Rekha ' bhi ' Sita Mata ' ka kya karti ... Saare ' Raavan ' toh Ghar ke Andar hi Baithe hai ...!!!
0,Aur triple talaq free me milta hi bina koi judicial authority ke
0,Aur triple talaq Miya vahan bhi kadi ninda kar dete apni behno ke liye .
0,Aur tu asli Muslims ke Triple Talaq ke case ladh nakilhindu
1,Baadshah ke Mahal mein thousands mein diye hote hain aur gareeb ke ghar mein very few
1,"Baazaar to saja diye Milad - e - Mustafa ( saw ) ke liye , Paighaam - e - Mustafa ( saw ) kya hai , ye hum ne bhula diya '.... Kashmir !"
0,Bachhe KI maut se JYADA important Hai Triple Talaq in naspiton KE liye . Muslim dushmani KA ek AUR saboot .
1,bachpan me jo Ludo kheli thi uski yad abhi tak gayi nahi .. kal ke temple run ke score bhul chuke hain hum ..
0,bahut ho gayi vote bank ki politics ... Ab caste based reservations ko khatm karke monetary based karne ka waqt aa gaya hai ..
1,Bas ek bar Rahul G PM ban gaye ... tau iss Desh ke ware niyare ho jayenge !!!! Aam Adami
0,"Batao ek taraf Congress Ram Rahim ke liye BJP ko kos rahi hai , dusri taraf politics ke Ram Rahim , Lalu ke saath manch share kar rahi hai ."
1,Batao ye uss site pr se akki sir ke verdict nikaal laaye jaha he ajay ki ek bi movie hit nai
0,BC Pakistaniyo sy apni politics sambhali nai jati or Trump ko farig karwanay k chakaron main par gaye hain Just Pakistani Media Things
1,behnun ko tou bulaya nae hum Junooni kis khet ki moli hen !
1,Bhagavad Gita was recited during Mahabharata war that killed millions :-) !
1,Bhai AAP apne sab Kharche ka Hisaab Deti hai .. Sab Jagah .. u r saying jo Party ka 80% ka pata nahi wo hisaab deti h I
1,Bhai best bowling line up hai aisa na bolo ..
1,Bhai Chai peeke aata hu . Thoda wait kroge ya apka shift khatm hogya . Waise Kitna kamaate ho per Hate Twt keliye .
0,Bhai ek baat sach bata screening me . Jinko bulaya jata hai bollywood ke . Logo ko aajtak kisi ne negative bola hai ? Hadd hai
0,Bhai Jann Prabhas bhi hona chaiye is list main usne bollywood 2 rs . ppl ke maa bhen ek kardi hai
0,"Bhai ji ye jo aapne itni badi baat kahi hai wo triple talaq pe q ni kha tha . Wo bhi to ek tarah ka julm hi tha , aapne awaj q ni uthaya"
0,Bhai mazaa aa gya new video me ab bs galli cricket ki ek aur video banao
0,BHAI MORALITY KI BAT WO NAHI KARTE . JO KHUD KI MORAL KO BECH KAR POLITICS KARE AUR APNA TIZORI BHARE . YE PUBLIC HAI SAB JANTI HAI .
0,Bhai Politics apni jagah par kisi bhi Hindu ladki ko Musalman kehna kaha sahi hai yaar . Ijjat sabse badi chij hai .
0,Bhai sab se pehle aaj cricket hi dekh lo baqi choro . Baqi ye b himmat hi hoti hsi k ache ko acha bolo is se aap ki ezzat barhti hai
0,Bhai sachaa deshbhakt hai pop bollywood celebrities ko sikhna chaahiye inse Nd many many congratulation Bhai Vijender Singh Jai ho
0,bhai wo log kitna cricket khelnge ..!! insaan hain wo bhi ..!! time milega toh hi toh khel paayenge ..!! Ashwin wagehra toh khel hi rahe hain
0,Bhai ye modi k bhakt ek no k chutiye h inhe bs har jagah apni politics nazar aa rai h
0,"Bharat ek esa desh hi , jiske sainikon ko Marne ke liye yudh ki jarurat nahin padti Yes hamare desh ki gandhi politics ki vajah se hi"
0,Bharat ke politics ke liye Koi shakat kaanun banana chahiye nahi to future me democracy se logo barosha uth jaayega .
0,Bhosdike Mulle lande pakistani .. Aaj teri Ammi ko bhej mere ghar ... kal fir uska triple talaq kar deta hu .. suvar ki aaulad
0,Bhutto ke naam py de dy bibi ke naam py de dy aur ab nakli Bhutto ke naam py de dy ... Ye hai politics ?
0,Bhutto ko maray 50 saal hogaye lakin ajj bhi bhutto kay pottat / nawasay bhutto k naam per vote le raye hain RIP politics Chiniot Bhutto Ka
0,Bihar me Lalu ko jo punish kiya is rha he wo bhe dekh lete Congressi intense chammach to aise sawal nhe puchte ... waha to badle k politics bologe
0,"BLB 102/8 (20 ov ), Summary : Manjesh Reddy 30(33), Pavan Deshpande 28(25). Sakuja 3/20, Ritesh Bhatkal 1/6. BL Bv HT Cricket"
0,Bollywood contestalert 1. Hawa Haw A 2. Chalti hai kya nau se baara 3. Kaala chashma . jachda e gore mukhde pe
0,bollywood ki yahi to life hai ..... achha hai thoda to pahena hai ....
1,Bomb banane waale Toilet banane ki baat kr rhe h
0,"Caption The Moment Micromax Cup Ind Vs SL "" Badshah hai cricket ke kaam me na kisi se kam Naam to suna h hoga Shikhar dhawan """
0,Ch sb .... Waqt se phle khuch bhe kehna munasib ni hota ... Politics mei khuch bhe final ni hota
0,Chaiya Chaiya - Dil Se PART 2 Dil Se SRK The Best Of SRK Bollywood pic . twitter . com / p VMF Cpa FU 9
1,chalo acha hai aap logon ne mujhey mera dp dekh kar follow nahi kiya tongue
1,Chalo kisi ko toh jeevandaan mila yahan ! Kisi ki toh jaan bchane k liye prashasan nr kadam uthaya bhle hi janwar k liye sahi !
1,"charagh tale andhera , khud nahin kare sake nibah , lekin oron ko mashwre !!"
0,childkillersarkar lagata hai koi minority aur dalit nai dead kia . Aisa hota to pura vipaksh aaj road pae hota . Phr vote politics chalu hota .
0,Chinese President Tweets in Hindi Kamino ..... Tumhara triple talaq aur Ram Rahim ka topic khatam ho jaye tho meri dhamki pur bhi focus Karna
0,Chinese presidents statement - kameeno tumhara triple talaq aur ramrahim ho Gaya ho toh Meri Dhamki par bhi focus Karlo .
0,Chutiya ko Apna Aukaat Dikhadiya . Yo 3 Khan ko Nahi hua aur Pura Bollywood Ko Nahi hua O Apne intense Kardiyaa
0,Ckt News : S Ajmal Sohail khan k Baa D Ab Umar Akmal Aur Shar Jeel khan Ko Be Wajah Cricket se Door Kiya Ja Raha Hai J Miandaad
0,Congress Visarjan Triple Talaq se bahar aa jao BJP walo Rail aur Rozgar ke baare mein janta ko batao
0,"Cow , Love Jihad , Triple talaq yahi to Desh ke asli mudde hai"
0,Cricket _ News : Umar Akmal Aur Kamran Akmal Ko Har Iss Coach Se Takleef Hai Jo Inhain Na Khilai ....* Waqar Younis
0,cricket dekh liya karo madam .... nahi to shahid afridi ko bhi bhool jayogi
0,Cricket ki baat me desh kahase aa gaya ??
0,"Cricket News : - Pakistan Main Acha Waqt Guzaar Rahe Hain , Shaiqeen Bohat Ache Hain , Wicket Bohat Achi Thi . Hashim Amla - "" Azaad"
0,Cricket pr jyada dhyan do jaddu Rajniti tumhe sobha nhi deti h .. Kya intense bhadwaa k list me tum bhi add hona chahte ho
1,Culturally rich honge .. par gavaaro ki basti bhi mera desh . Su Said india
1,"CWG is like .. ram jee kee bakree ram jee kee khet , kha le bakree bhar bhar pate ( stomach ).."
0,Dalit dalit kar ke tu or tari soch wali party hi politics kar rahi hai .... Tujhe Hindu main badi dilchaspi hai tu ghar wapsi Karega kya ?
0,Dar chutiya hai ye bhi . Bachche mar gaye aur isse politics sujh rahi hai .
0,dear sir khub imandari se Kaam kro or Kaam se desh ke politics me bata do real Sab ja Sath Sab ka Vikash kya hota he
1,Deen Ka Mazaaq Bana Kar Rakhdiya Hai Aur Phir poochtay Hain Yeh Pareshaaniyan / Azaab Hamaray Liay Kyun ?
1,"Dekho "" Time "" ke pass bhi rukne ka time nahi hai"
1,demand karne walon ki supply zyada hai . fb
0,desh me yuva berozgaari se pareshan hai aur budhawe ko triple talaq ki padi hui hai
0,"Development tum logo ka bahut kiya congress ne 60 saal me . Daliton se bhi buri haalat me ho . Kabhi triple talaq , shariyat ke alawa bhi socho"
0,dhoni ke upar baty Nhi karna chahiy o 2019 tk jarur khely Aur gambhir ko ipl se bhahar kar Dena chahy
0,Doob k vo marein jo tumhare jaise bacchon ki maut pe politics kr rahe hain .. laanat tum pe hai jo bacchon ki maut ka tamasha bna rhe ho ..
0,Dowry deaths bahu ko jala kar mardiye jaraha hai Agar triple talaq hota toh voh husband ussey chord deta maarta nahi
0,Ek debate program me inhone Kaha tha ki Yogi Jaise Sanki ko Party se Nikal do . Ab Yogi inka role model hai . Politics kya kya na karwaye .
1,Ek Salman hai jo aapni jeb se gareebo ko paise deta hai aur ek Salman hai jo viklang / Garib ke paiso se aapni jeb bharta hai !!!
0,Ek sham Yateem bachon ke naam charity Event pressconfrence bollywood Dkshroff mustakkhan sunilpaul Mumbaipic . twitter . com / gv J 37 T 5 b TA
0,England Ki Sabiq Khatoon Cricketer Jan Barten 58 Baras Ki Umar Main Chal Basi . Jan Barten Kaafi Arse Se Cancer K Marz Main Mubtila Thin .
0,Failed politics . Aap ka pas kuch karne k liye nahi hai toh aap Rahul gandhi ki aaloo ki factory me kaam kijiye .
1,"First woman IPS of India is praising the Person ( Amit Shah ), jinki history se aap sabhi vaakif honge . Gajab hai yar .."
0,For eg triple talaq ki baat huyi toh koi celeb aage nahi aaya . Particularly the Khans .
0,Ghanta laate ho subha se waha dera daal kar baithe the chutia mat banao jab up me train palti thi tum saalo cricket dikha rahe the
0,Ghatia aurat tumhara Allah hi Hafiz hai . Aik bachay ki jaan se ziada tum logon ke liye politics azeez ho gai hai . Pooja Karlo behn NS ki .
0,Ghatiya aurat ! Kuch to khuda ka khof kro ! Politics k liye quran ka mazaq na urao fazul logon
0,Golden Era of bollywood 2010-2016 Now end ... Jisme film or star ke naam pe kuch bhi chal jata .. ab nahi chalega .. Achha lao nahi to jao ..
0,Gorakhpur Gaya tel lene . Harayana stalking case bhad mein triple talaq imp hai
1,"Gurmeet Ram Rahim Singh "" insaniyat naam ki cheez hai nhi "" Aur aise log naam ke peeche "" insan "" laga te hai ..!! tusharspeaks"
1,"Ha , bhot tarakki kar raha hai"
0,Ha ha ha . Triple Talaq PE apani bivi KO pareshan karane vale secular gyan de rahe hai . Congress is gangotri of scam . Dr Kafil Hero ?
0,Ha ha wo aap per bhi lagu hota hai .. Ye politics hai aur Ye sab jayaz hai ..
0,Ha triple talaq wala case khatam ho gaya kya ... Abhi berojgar hi honge
1,Haan sahi baat hai .... Mushaira jinko sunate h kumar sir woi log to atankwaadi hote h unko hi maar dena chahiye .... growup
1,haan wo to bichara fokti hai kuch kaam dhaam nahi hai n din bhar free betha rehta hai !!! tongue
1,haha .. dhoondhne waale to bhagwan ko bhi dhoondh lete hai ... aap bhi dhoondh lo
0,Hahaha Abe chutiye ye original cricket insider ka logo tune bhi laga diya Bade madarchod hai tu wale ke naam pe bheekh
0,"Halaala apni maan SE , behen ke saath , triple Talaq , polygamy , terrorism , 4 shadi sooar ki tarah 40 bachche muslim culture hai . U HATE UCC"
0,Hamary Mulk Mein Roz Cricket Bahal Ho rahe Hote Hai Pata Hai Kyu Kyu ke Ham Log Jahil Hai yeh ek Lolipophai
1,Han yar is liye kyun ke engagement tu batai baghair hosakti hai -__- SARCASM
1,har cheez mahangi ho rahi hai rupaye ko chhod ke
0,hardik badhai cha a realheros of nepal ......... cricket ko safalta le desh ko naam laai sagarmatha bhanda aajha uchaima puraos
0,"Heard Through 154/7 (20 ov ), Summary : Mayank Agarwal 68(46), Vinay Kumar 21(17). Vyshak V 2/29, Shreyas Gopal 1/15. H Tv MW Cricket"
0,"Hey ! The PM had called for Swachh Bharat , not Swachh Sri Lanka ! Aerial ki dhulai kar daali yaar ! Whitewash Ind Vs SL Cricket"
1,hinduon ki haalat pe bahut badhiya observation .. bahut jaichand ( secular ) bhare hain jo musalmaano ki chaat te hain .
0,Ho gaya lasho pe politics Khel ke ? Politicians se toh tu zyada harami hai be . BC .. Mar kyu nahi jaate kahi jaake . Sharam karo madarchodon
1,"How life changed from "" chi .. uske mu se pyaz ki badbu aa rahi hai "" to "" omg .. uske mu se pyaz ki smell aa rahi hai """
0,Hum abhi tak sirf hindu muslim cow protection triple talaq public toilet par hi atke hue hai toh usko toh aage badhna hi tha
1,i ment wafadar hone ke baad bhi kutta ek gali hai lol
0,"In india , Pehle FIR fir case file hota hai ( Fir politics hoti hai ) Fir jaanch hoti hai Fir agar suboot mile to 5 yrs later saza hoti hai"
0,Inase Milo Harayana Aur Punjab Ki Lagi Padi Hai Ye Politics 2 Khel Rahe Hai Phir Hum Inhe Chutia Bol Sake Hai
1,Insaan bhi kinta Haramkhor hai ! Pehle bullet banayega fir usse bachne ke liye bullet proof jackets !
0,Insaf aur ehtesab ab to Pakistani politics main hathiyar ban giya hai jo seyasi hareef ke khilaf istamal kiya jata hai . NS PMLN
0,"Insha Allah Pakistan mn cricket dobara bhaal ho jae gi ,, aur phir ground sajen gae , phir khel hongae !!!!!"
1,inshallah Metro Bantay he TTP ka khatma hojaye ga Showbaz Shareef
1,Insults You Dont Want To Hear . kya kaha Hindi nai aati ? bot majakiya h aap ... kya sacchi ni aati ? English pakka aati hogi Hindi Diwas
0,intense Oyee aap bhi ho .... kaha aap log to bas politics batiyate ho hamse nahi to bakaiti . In surk aankho ke dard ka sabab bhi nahi puchhta koi
0,IPL Media Rights ab heera thakur chuttiya kamm manaega congrats star
0,is larkio se mujhe 1 baat puchna tha ki islam me apko kya a 66 a laga ? burkha ? triple talaq ? or koi khas chess ?? hume to dikhti nehi kuch khas ?
0,is setting new low standards in politics . Anpe baap ki umar ke vyakti ki is tarah beizzati mat karo . Upar wala dekh raha hae .
1,Is social network ki bhaaree bheed mein hone ke baad bhee hum sab akele hain !!!!
0,"is waqt politics , ilzam bazi ki bjye sbko milke apne mulk ke androni halat ko behtr krna hoge , tbhi bahar walo se bhi lard ske ge"
1,Ise kahte hain vikas . Pehle khaana bhi nahin milta tha ab seedhe chinese cuisine serve ho raha hain .
0,Isi congress ke diye hue naasor ho tm log . Jiski wajah se ye desh faltu cheejo me uljha hua hai . Chahe wo kashmir ho ya triple talaq .
1,ismein bhi Modiji ka haat hai .
1,Iss duniya mein Sonam Gupta hi nahi mere dost bhi bewafa h brij 1709
1,"Itne ' neta ' hain India mein , ki jaha khudai karo vahi se aawaz aayegi , "" arre mujhe bhi to nikalo , mai bhi hu yaha pe """
0,Its all about politics Agar kisi ko triple talaaq ke bare me nahi pata hai to uske bare me puche Aur media ko dalali band kar dena chahiye
0,jaa bhai tu cricket khel . kuch bhi bhaukta rehta h
0,Jab shiv sena wale mumbai main north indian ko pitte hai . wo bhi kya desh bhagti hai in ki ?. Sab vote bank ki politics hai
0,Jail me bhi cricket match dekhne ka vewastha karwa dete Bada dikkat ho rahi hai Sirf kalpna karke kaam chalana pad raha hai
0,jaise chutito ko bollywood ke logo ne hi sar pe chada rakha hai .. jaise taklu aur uske bete ne
0,jese 30 hindu funduos ko goli mare gai hai waise triple talaq ko defend karne walo ko goli maar deni chahiye Kya rai hai
0,Ji . Hai ... namaz / roza / Haj / zakat .. muje Islam kae mazab par chalne do .. Islam kae Naam par triple talaq nahe chaaeye
0,ji ... kya aapne triple talaq ka swagat kiya ki nhi .....
0,Ji is baat me ham aapse sahemat hai .... phir viklp badhane ko kyu naa sochate ?.... padhe likhe log kyu naa politics me interest le rahe hai ?
0,ji kya ghar pane ke liye hume bhi politics khelni padegi jaise neta vote pane ke kiye khelte hain . Modi Save Amrapali Buyers
0,Jihadi Mindset Beti ko na padhao Beti ko Burkhe me rakho Beti ko terroristo ko bachane ke liye use karo Aur triple talaq deke safar karne do
1,jin ke sath hum apni zindagi bitaane ke khwaab dekha karte they ~ Aj unke khwaabo me aane se hum sehem se jaatey hain
0,"Jinko Jai Hind , Vande Mataram aur Bharat Mata Ki Jai par Politics Najar aati hai aur jo ye sab mante hai Mar Jao . Independence Day India"
1,"Jitne Bhi Ladke Aj Women ' s Day Women ' s Day Kar Rahe Hai , Unme Se 98% Ladke To Roz Maa Behen Ki Galiya Dete Hai . -_-"
1,Jitni kisi ki shakal 3110 jaisi hai .. Bas uski banday ke hath mai Iphone 5 S hoga . !!
0,Jo desh ki raksha karte karte apni Jan dete hai usko hum hero nahi banate . Lekin cricket match jitane vali team ko paisa aur pyar bahutdete .
1,jo log din raat print / electronic media par apni har baat bolte h even fantasies bhi vo ye bol rahe h ki unhe bolne nahi diya ja raha
0,jodhpurbanarthana triple Talaq se pidit Roshan Banu ka Bura Haal please help
1,"kaafiron ' ko ' masjid ' mein ' namaz ' perhtay huaay maara gyaa .. bohat khoob , mashallah !"
0,"Kabhi edher kabhi udhar , achcha lagta hai , politics mein . khattar should resign ."
1,Kabhi kabhi achey pita ke yahan kutil santaan janam le leti hain ! of being Nehru Azad amar hain
0,Kahen aisa tu nahi ke Pak cricket team ki tarah sirf start he acha liya ho NA 120 PTI PMLN
1,Kal jahan Ramzan Transmission p natein aa rai thi Aaj wahan Chand raat mailey main dance horaha hai
0,Kal WI ne ENG Ka shikar kiya Aaj BAN AUS Ka karne ja rhi Ye ho kya rha hai Cricket mai . aaj to ur AUS Fan friends .. BA Nv AUS
1,Kam se kam Jai shree ram keh k jaan to bach jaati hai ..... Kahi allah hu akhbar keh k jaane le li jaati hai .....
1,Kapil Sharma se accha mazaak to meri zindagi kar leti hai
1,Khuda Tamam Khud Kash Hamla Awaron Ko Lambi Umar ataa karay -
1,Koi apno ke liye jina chhod deta he ....... toh koi jine ke liye apno ko chhod deta he ........ life
1,Kya stud Banda hai tu yaar ! Wah wah !
1,Maiden shabash bas ab aisay he khelo -.-
1,Main bachata raha deemak se ghar apna .. aur kuch kursi ke keedey poora desh khaa gaye .. :/ Pappu maunibaba India
1,Mehngai k har dn is tarah badhte dekh Ek din essa aayega jab golgappe khana sirf shaadiyo mein he naseeb hoga .
1,"Mera Bharat Mahan ! Beti Bachao , Beti Padhao , Indeed ! pic . twitter . com / e 0 Z Ko Ai P 4 V"
1,Mubarak ko kabhi sharm to aayi nahi . Ab wo Sharm naam ke shehr mein ja raha hai .
1,nahi media to POP JOHN PAUL ke Avataar hai
1,Nawaz sharif aur zardari ko elect karni wali qom trump par tanqeed kr rahi hai
1,"nowplaying Zindagi ke safar mein guzar jaate hain jo muqaam ..... woh fir nahi aate , woh fir nahi aate :\ lifeisharsh"
1,Pakistan ko 229 tak Umar aur Wahab ne puhnchaya . West Indies ko bhi 229 tak Umar aur Wahab ne puhnchaya . Pak Vs WI
1,Pani se chalnewali car & ISI se chalnewali sarkar .. Sirf Pakistan me hi dekhi ja sakti hain .
1,Peetal ki baaliyon mein beti biyaah di // woh baap kaam karta tha sone ki khaan mein !! shair
1,PM khud Ghulaam hai aur deta hai Speech Azaadi par ? Independence Day
1,"Pyaar Non Poisonous Retweet : "" Zeher hai ki pyaar hai tera chumma ?"" - Mr . Snake to Mrs . Snake ."
1,Qaumi zubaan Urdu hai par Taleem ka matlab achi angrazi hai Pakistanithings
1,Real life : jo dikhta hai woh hota nahi ! advertising world : jo dikhta hai wahi bikta hai ! bt fact
1,"Reliance Arey Aap ki company ki advertisement kum ho gai ? Aisa mat kariyo , aap thode aur lutt lo aam janta ko lekin top par raho pun"
1,Retweet : Jaise India mein bohot kaam hai tumhe .
1,Saare baghwaan apne ghar pe hai . Chaar dham ki yatra mat karo . Uttrakhand mat jao . - Aunty who was in Uttrakhand to meet God .
1,Sabse Zyada sukh deti hain is duniya main ... - aurat ... Sabse Zyada dukh Bhi deti hain - aurat ..
1,sahi btayi ki kala dhan hatana ta ya gandhi ki photo
1,School ke bacche baarish me bheeg rahe aur kutte ko raincoat pehen kar ghumaya jaa raha tha . True Scene At Kandivali Aam Aadmi Vs Sarkar
1,Shareef wo hai jisay moqa nae milta !
1,tum tweet - tey bhi i Pad se ho aur hume jata rahe ho k tum gareebi rekha se niche ho ? Such Is Life
1,U . P me log chutiya aur electricity bahot jada kaatte Uttar Pradesh electricity sarcastic
1,uski gand mein dum hai .. agar kisi aur ke gand mein nahi hai to uske baap ka kya jaat hai ... with gand
1,Voh banda bhi yeh line bol k baaki intense 100 jaisa ho jata hai
1,Wah wah humara beta fail hua hai ! Khandaan ka naam roshan kar dia beta tune Things Desi Parents Say
1,yaar Mairay sath tweeting kr kr k lagta hai smart ho gayai ho lol
1,Ye pakistani sainik ka khat hoga . Bhatiye hota to patra likhta tatsam Hindi ya Sanskrit mein
1,Yeah IPL hai sir Yaha Sab Kuch hota hai M Iv SRH IPLT 20
0,yes sir kahete he na ki cricket me kuch bhi ho sakta he kal ke match me dekh bhi liya .
1,"Zaat e aadam ki ye tarakki to dekho , Udna safar ban gaya aur chalna "" suffer """
1,"Zinda log ikaththa ho rahe hain , Kahin koi mar gya hai shayad . shair kavya Life"
