instance,rohanrajpal/bert-base-codemixed-uncased-sentiment,Sangramsing/whisper-large,michaellee8/wisper-base-jwt,Geotrend/bert-base-15lang-cased,lesliejd/jt-whisper,racheltong/whisper-tiny,nbroad/mt5-base-qgen,AbhirupGhosh/opus-mt-finetuned-en-hi,S-Fry/large,Helsinki-NLP/opus-mt-iir-en,damerajee/hindi-english,nbroad/mt5-small-qgen,Varosa/mbart-many-to-many,aditii09/whisper_eng_asr,bitextor/bicleaner-ai-full-en-hi,patrol90/whisper-large,Helsinki-NLP/opus-mt-en-inc,setu4993/LEALLA-base,Areeb123/En-Hi_Translation_Model,rohanrajpal/bert-base-multilingual-codemixed-cased-sentiment,monsoon-nlp/muril-adapted-local,Evan-Lin/whisper-large-v1-tw,defining/maggle,rohanrajpal/bert-base-en-hi-codemix-cased
"Jeene ke aarzoo mein mare ja rahe hain log, Marne ki aarzoo mein jiye ja raha hoon main. #irony",33,35,35,32,35,35,33,42,35,53,42,33,33,35,33,35,41,28,42,33,31,35,35,33
+10000000000000000000000000 Daridrapugotu politics Thatha chesarani manavadu cheyyalani em ledhu ga Asalu avarasaram ledhu mushti rajakeeyam,45,47,47,45,47,47,36,53,47,68,53,36,40,47,40,47,50,37,53,45,41,47,47,45
SABKO YEH CHINTA THI KI TRIPLE TALAQ PAR MUSALMAN GARMJOSHI NHI DIKHA RAHE LO AB ASLI GARMI DIESEL AUR PETROL K SAATH BULLET FREE,40,59,59,68,59,59,44,67,59,96,67,44,48,59,48,59,66,49,67,40,67,59,59,40
Bhai hum sab bhi door rahte thy..Mai bhi politics mai koi interest nahi rakhti thi..Sirf textile designs ke baare mai hi jaanti thi,41,47,47,41,47,47,36,50,47,73,50,36,37,47,37,47,50,34,50,41,32,47,47,41
"Wah Pappu Ji politics karne ka koi mauka nahi jane dete, DM ko kaam karne do bhai. Aur khud bhi cooperation karo, MP ho.",39,44,44,37,44,44,32,48,44,64,48,32,34,44,34,44,48,32,48,39,29,44,44,39
Shah Rukh Khan visited Dilip Kumar Saab and Saira Banu Ji.  #ShahRukhKhan #SRK #KingKhan #DilipKumar #SairaBanu #Bollywood #FilmyWavepic.twitter.com/ZwKsT3Ps6a,63,76,76,66,76,76,59,75,76,97,75,59,66,76,66,76,71,58,75,63,58,76,76,63
#entertainment #bollywoodnews #news #bollywood #hollywood #tollywood Kuch Rang Pyar Ke Aise,29,35,35,29,35,35,20,30,35,56,30,20,25,35,25,35,33,21,30,29,23,35,35,29
aaj cricket khiladi neelam honge... khair khiladi to khel ko hi neelam krne lage gain...fir khud neelam hona kaun so badi baat hair.,49,50,50,50,50,50,45,54,50,68,54,45,41,50,41,50,53,43,54,49,33,50,50,49
@myogiadityanath Sir.. Deceased Bachcho pe #Politics hone mat dena..! Dosiyo ko Sazaa Jald se Jald dein.. Lipa-Poti mat hone dena.,47,49,49,49,49,49,45,60,49,75,60,45,51,49,51,49,58,44,60,47,48,49,49,47
Triple Talaq Too All World Hated Harami Terrorist Mulla Lok Detay Hai.Jiska Nahi Hai Kuch Ma'am Sanmaan O Harami Ki Ollat Muslim Hai,39,44,44,38,44,44,37,48,44,65,48,37,37,44,37,44,46,36,48,39,40,44,44,39
"Bharatiya shabd ke saath ""Choli ke peechhe kya hai"" -- yeh crass culture naa jore toh achha hai. Bollywood ko usi ke naam se rahne dijiye.",53,56,56,51,56,56,47,61,56,74,61,47,44,56,44,56,59,43,61,53,43,56,56,53
"Khamosh hai mera desh kisano aur jawano ki maut par, suna hai theatre me bht bheed hai, #bahubali ki maut par.....#irony",46,47,47,46,47,47,39,55,47,61,55,39,41,47,41,47,49,39,55,46,38,47,47,46
Kaise baat Krte Ho... Like Gla dabaya Ho..  Politics m aise hi aaroop lagye jate h Jiii.. Jababdehi to gov ki banti hi h.. Bachho ka sawal h,55,54,54,54,54,54,53,58,54,79,58,53,52,54,52,54,58,51,58,55,50,54,54,55
"beta pappu, salman khurshid or kapil sibal ko triple talaq ke favor me ladne kyu bhejte the?? Dogle kahin ke...",39,47,47,40,47,47,33,45,47,56,45,33,35,47,35,47,46,38,45,39,34,47,47,39
Pad Se Nahi....Lagataar Karya Karne se Banti h Vyaktitv ki Pahchaan.  Mauka h Mauka..Kuch Kar Dikhane ka..Jai Hind..Politics with Principal,50,53,53,54,53,53,44,62,53,76,62,44,47,53,47,53,56,46,62,50,52,53,53,50
Dost aaj Tu sirajul-haq sahib nay cricket ko halal game maan Kar JI ke basic policy ko reject kardea aapko aaj unn ko Mubarakbad daina chaiy,46,49,49,47,49,49,46,54,49,74,54,46,40,49,40,49,51,35,54,46,38,49,49,46
Wo to triple talaq nahi accept kar rhe ye to Mandir hai,15,23,23,15,23,23,13,19,23,25,19,13,14,23,14,23,19,15,19,15,15,23,23,15
"Kshatriya, sikhs aur jaat regiment  ki Army china border par khadi hai.. bhai reservation aur religion politics wale kaha mar gaye..",38,37,37,38,37,37,35,45,37,67,45,35,38,37,38,37,43,31,45,38,29,37,37,38
tu apni baat kar #tripletalaq or #halala par,15,18,18,15,18,18,14,19,18,22,19,14,13,18,13,18,20,14,19,15,13,18,18,15
bhai sukr hai tum jinda ho to desh bacha hua hai.,19,22,22,19,22,22,16,23,22,25,23,16,16,22,16,22,23,16,23,19,15,22,22,19
"Cow ki mahtta ko hamare poorvajo ne hazaro sal pahale samjha& sadiyo se seva kar rahe  Parantu aaj gau par politics & gaumenia,dikhava,dhong",47,52,52,47,52,52,42,58,52,80,58,42,44,52,44,52,57,42,58,47,41,52,52,47
Saam Dhaam Dhand Bhed _ Chanakya of Politics _ Amit Shah,18,20,20,19,20,20,20,19,20,29,19,20,18,20,18,20,19,16,19,18,17,20,20,18
Kya Aaj tak wale TV chod diye Bollywood Jane ki soch h kya to aachchi soch hi jaao,31,33,33,28,33,33,24,34,33,45,34,24,24,33,24,33,34,24,34,31,20,33,33,31
Bak bak bak... Abe chup kar Chutiye kab tak ek hi rag gata rhega. Ab tujhe cricket se bhi problem h? Chal chhod ye bta tera friend kesa h?,52,50,50,52,50,50,41,57,50,70,57,41,41,50,41,50,58,42,57,52,49,50,50,52
jab aap jaise lov bhi politics join jar lenge Jo ki corruption ka dusra naam hai ...to yahi hoga,30,31,31,31,31,31,24,33,31,49,33,24,26,31,26,31,31,26,33,30,24,31,31,30
eesi ka Naam politics hai...in politician ki wajah se Ram Rahim jaise log crime karne ki himat kar pate hai.,32,33,33,31,33,33,30,39,33,57,39,30,28,33,28,33,36,28,39,32,28,33,33,32
#Islam wo pooda hy jitna kaatoge utna hara hoga #Hadiya tumhari aulad hy #TripleTalaq ka dhung bhi use nhi rok paya #BraveHadiya,46,57,57,47,57,57,41,59,57,74,59,41,44,57,44,57,59,42,59,46,46,57,57,46
"#TripleTalaq BJP ko Triple Talaq pe bolna nahi chahiye, is se budhi jeewi  Muslims convert ho rage hai Hindu mein",37,39,39,35,39,39,33,43,39,64,43,33,33,39,33,39,37,30,43,37,29,39,39,37
Mahila Sangathan aur Bollywood ki dogalpanthi khul ke samne lane wali Kangna ka main samman karna chahunga har ladki ko seekhna chahiye isse,44,48,48,44,48,48,37,52,48,70,52,37,38,48,38,48,51,36,52,44,32,48,48,44
Talak ka aaj talak ho gya #TripleTalaq,14,20,20,15,20,20,14,20,20,21,20,14,15,20,15,20,18,15,20,14,13,20,20,14
Sir ji foreign tours me AAP sirf kaam k liye karta hai Aur Modi ji to picnic pe jate hai na ? #sarcasm,32,36,36,33,36,36,34,40,36,52,40,34,31,36,31,36,40,28,40,32,26,36,36,32
"@sardanarohit kahaan gya ab??  #TripleTalaq par atka hai,  ye kya ho raha hao dekha hai??  @ZeeNewsHindi",39,48,48,43,48,48,31,51,48,57,51,31,35,48,35,48,50,37,51,39,35,48,48,39
"@KapilSibal tune jo triple talaq ko bhagwan shri RAM ki ashtha se compare kiya he uske liye tu ye deserve krta he - ""Aaaaaaaaaa Thuuuuuu""",51,55,55,51,55,55,42,63,55,81,63,42,43,55,43,55,60,47,63,51,42,55,55,51
"Agar Triple Talaq dene walo ko saza milna chahiye, To bagair Talaq diye apni biwi ko chordne walo ko kya milna chahiye???",44,45,45,45,45,45,38,48,45,63,48,38,36,45,36,45,47,37,48,44,37,45,45,44
Lala aap k bagher bekaar pheeki hai cricket and meri is baat se sab agree karengein ok,28,29,29,28,29,29,24,33,29,45,33,24,27,29,27,29,32,22,33,28,23,29,29,28
International cricket kuch zyada hi bhari parh gayi hai Lahore par,17,21,21,16,21,21,16,20,21,31,20,16,16,21,16,21,18,15,20,17,12,21,21,17
"Band kariya triple talaq, nikah halala aur laayiye uniform civil code. Polygamy illegal hai hindu code bill ki wajah se.",33,42,42,33,42,42,31,43,42,64,43,31,30,42,30,42,39,29,43,33,33,42,42,33
Kuch jyaada ho gaya !! Bhai ... 33 Crores Hindu God hai !!! To Cricket me 2 Kyu nai,32,29,29,32,29,29,26,32,29,45,32,26,24,29,24,29,31,29,32,32,28,29,29,32
Abe lol... kabhi school bhee kaya kar ulloo .pure bollywood mein srk hi ek aisa actor hai  jisne aaj tak ek bhi disaster movie nahi di hai,45,49,49,44,49,49,45,55,49,74,55,45,40,49,40,49,56,37,55,45,36,49,49,45
@ashajha yaha 14.20% Muslim's ne #TripleTalaq pr #SC k faisle ka samman kiya or waha #panchkula me #RamRahimVerdict challenge bana baitha h,51,55,55,51,55,55,44,60,55,72,60,44,46,55,46,55,58,49,60,51,47,55,55,51
Kal m ja rha MAYOR banne   Shree Dinesh Sharma Ji ne Mayor(Lucknow) ki seat mere liye chod di  #Sarcasm,35,40,40,36,40,40,31,41,40,55,41,31,34,40,34,40,38,31,41,35,30,40,40,35
Tum Pakistanis sudhar jao tumhari cricket ki kitne awkaad hai ye ise baat se ptta chlti hai ki hmse khelna kai liya bhikh maang rahe ho,47,51,51,46,51,51,44,60,51,73,60,44,41,51,41,51,57,40,60,47,38,51,51,47
Faltu comments pe dyan mat do Raj kal cricket na ho To aap ke pass ye koi nahi ayega dene ki liye sab chu..... hai  ja jile apni jindhagi,48,46,46,47,46,46,39,54,46,67,54,39,38,46,38,46,52,40,54,48,40,46,46,48
Ye farzi rastravadi hai sale. Tricolour Ka bhi apni ghatiya politics ke liye disrespect Kar rahe hai. Deshdroh Ka case register hona chahiye,44,45,45,44,45,45,37,46,45,68,46,37,36,45,36,45,46,38,46,44,35,45,45,44
Ispe bhi politics..  Jalte ghar pe roti sekna aapse sikhe koi!!!,25,26,26,25,26,26,19,28,26,37,28,19,20,26,20,26,28,22,28,25,22,26,26,25
"Jis desh me #Cricket ka junoon ho,wahan agar log #Badminton dekh rahe hain,to ye kuch aur nahi balki #Indians ka pyar hai @Pvsindhu1 ke liye",48,58,58,47,58,58,43,63,58,71,63,43,45,58,45,58,61,43,63,48,42,58,58,48
Wha 're hudustaan supar politics hai yar tum sab kabhi bhi modi ka takar nhi le paaoge  bihar  me aafat hai,38,42,42,38,42,42,31,44,42,52,44,31,33,42,33,42,44,29,44,38,31,42,42,38
Haan abhi tak Jo karty arahe Hain jazbat apni jagah Wali politics nateeja dekh lain...,30,32,32,31,32,32,23,36,32,47,36,23,24,32,24,32,34,25,36,30,26,32,32,30
"Triple talaq & polygamy ke naam par par 4-4 biwi rakhte hn, triple talaq ke naam par usko darate hn, uska rape karte hn  , phir nyi biwi.",48,62,62,49,62,62,45,58,62,72,58,45,48,62,48,62,55,43,58,48,46,62,62,48
Jis din khud par ayegi uss din bhi nanhe baccho ki chita par apni politics ki rotiyaan sekna :),32,33,33,32,33,33,28,38,33,50,38,28,28,33,28,33,39,28,38,32,30,33,33,32
Yahi to masla hai dunya technology mai kaha pohanch gai aur hamse politics jhagre hi khatam nai Horahe kam se kam 1 govt ko to pora jonedete,43,52,52,43,52,52,40,57,52,72,57,40,44,52,44,52,55,37,57,43,41,52,52,43
"5 September  1975  Nishant - @AzmiShabana , Smita Patil, Girish Karnad.  2003 Kuch Naa Kaho,  Calcutta Mail, Rules  #Bollywood #nostalgiapic.twitter.com/2DADTITS9G",59,70,70,57,70,70,51,64,70,91,64,51,55,70,55,70,62,48,64,59,51,70,70,59
"Makkah se crore log ki astha hai, isliye kuch nahi bol raha samjha. Tu development aur politics pe rah, fir dekh tamasha",39,40,40,39,40,40,30,45,40,62,45,30,34,40,34,40,41,29,45,39,28,40,40,39
@BeingSalmanKhan  bhai yaar ek baar story toh sun lo cricket ke upar mera ghar bikne ae bach jayega,34,39,39,35,39,39,34,41,39,50,41,34,31,39,31,39,40,30,41,34,28,39,39,34
@CR7Sahib teri tareef mai bhe kuch #sarcasm chupa reheta hai.... ;|,32,30,30,32,30,30,26,34,30,36,34,26,24,30,24,30,34,26,34,32,28,30,30,32
"""Dur jaake bhi mujhse tum meri yaadon main rehna kabhi alvidaa na kehna...""  PART-1 #KANK #SRKRani #SRK #TheBestOfSRK #Bollywood pic.twitter.com/AV1OZPe52u",70,76,76,74,76,76,51,79,76,97,79,51,57,76,57,76,79,63,79,70,65,76,76,70
"Bharat ek aisa desh hi , Jiske sainikon ko Marne ke liye Yudh ki jarurat nahin padti.  Gandi politics ki vajah se mar jate han.",44,49,49,43,49,49,43,57,49,66,57,43,41,49,41,49,51,37,57,44,32,49,49,44
Kal kisi ko Hindustan dekh na tha to Mumbai aakar dekhta Koi kis ko naam aur religion nahi puch raha tha Salute to Mumbaikar  politics  pic.twitter.com/6O74wXAgiJ,57,66,66,54,66,66,43,60,66,86,60,43,45,66,45,66,57,43,60,57,44,66,66,57
G Han NAAHIL # Shraif ki sirf in say kafi banti thi jo in ko politics main lay kar aye*  KUCH SHARM HOTI HAY pic.twitter.com/krbB4fi2MR,52,58,58,59,58,58,47,61,58,84,61,47,51,58,51,58,59,48,61,52,52,58,58,52
Abe tuje bewakuf bnane k kiy kha unhone....isi ko to Politics kehte hai Aatankwadi...ab Army dekh kitne or marti hai..ha ha ha ha,52,49,49,51,49,49,44,55,49,73,55,44,45,49,45,49,54,45,55,52,45,49,49,52
Gaay jaise sidhi duniya me koi jiv nhi hai log politics karne k liye inke naam se bhi rotiya sek lete hai.,36,38,38,36,38,38,31,43,38,55,43,31,30,38,30,38,42,29,43,36,28,38,38,36
Sir jee sb isi tarhan.chalta.rahe ga. Cricket board.bhi pakistan ka.hi idaraa hai,30,34,34,30,34,34,28,37,34,44,37,28,28,34,28,34,34,25,37,30,25,34,34,30
Sir aap bole diya hai...kaise dekh sakte hai moive hum...bas aap he bache hai Bollywood main living legend Amit bachan ke baad,44,42,42,43,42,42,31,47,42,68,47,31,30,42,30,42,47,35,47,44,32,42,42,44
inka ek mantri to ration card banake bhi jail gaya hai.  #sarcasm #aaprationcardparty,28,29,29,29,29,29,28,31,29,38,31,28,27,29,27,29,31,23,31,28,24,29,29,28
Nayak film ka Dialogue  Kuch buse jalti hai to jalne do  Kuch log marte hai to marne do  Ye Sab Humare voters hai..  Shame on Politics...,42,47,47,42,47,47,39,44,47,69,44,39,40,47,40,47,44,40,44,42,40,47,47,42
dharam aur desh ki politics band honi cahiye,14,15,15,14,15,15,11,15,15,22,15,11,13,15,13,15,14,11,15,14,10,15,15,14
Mujhe cricket khelna pasand hai,10,11,11,10,11,11,9,12,11,16,12,9,9,11,9,11,12,9,12,10,7,11,11,10
@hiyer hehe #irony is jis thali mein aaj khaya. kal usi thali ko khaayega,29,32,32,30,32,32,26,34,32,40,34,26,25,32,25,32,33,24,34,29,26,32,32,29
@NDTVRavishKumar #TripleTalaq band hone se kya desh ki economy sudhar jayegi  #DalitAtrocity khatm hogi  #Vikas ki raftaar badegi,45,57,57,50,57,57,44,60,57,78,60,44,47,57,47,57,54,43,60,45,36,57,57,45
"Aur faraz chahiyen kitni mohabbten tujh ko, Maaon ne tere naam pr bachon ka naam rakh diya..  #irony",36,46,46,36,46,46,32,42,46,50,42,32,31,46,31,46,43,32,42,36,33,46,46,36
Bollywood bhi Dawwod ke saath Babut saal kaam kiya hai to iska MATLAB kya hai ?,29,32,32,29,32,32,23,35,32,43,35,23,21,32,21,32,35,20,35,29,21,32,32,29
Cricket News Azeem Maqsad K Liye Us Se Barrh Kar Kuch Nahi Ho Sakta. Shahid Afridi #Sufyan Gulzar,35,39,39,35,39,39,32,42,39,52,42,32,30,39,30,39,37,30,42,35,33,39,39,35
Mera bhi achha nahi tha par baad mein Kabbadi aur Cricket.,17,22,22,18,22,22,17,24,22,29,24,17,14,22,14,22,23,14,24,17,15,22,22,17
"Yeh sambit patra sirf non bjp ruled state politics karta hai aur pur din debate debate khelta rehta hai,",30,31,31,30,31,31,29,36,31,52,36,29,27,31,27,31,37,24,36,30,23,31,31,30
Kya ham sach me Chinese chizo ka bahiskar karte hai. Hamari bhartiya cricket team ki Tshirt me bade bade achharo me OPPO ka prachar ho rha h,47,49,49,46,49,49,39,51,49,69,51,39,41,49,41,49,50,39,51,47,38,49,49,47
"Khwabon Ko sach karne ke liye ,Titli ne saare rang bech diye  #talksassy #poetry #Bollywood",30,36,36,28,36,36,28,39,36,48,39,28,31,36,31,36,39,26,39,30,27,36,36,30
Jab tak Bhakts jaise Chutiyon Ki Aankh Na Khule Tak tak ye chalta rahega... 1) Gandhi  2) Gau 3) Ganga  Triple Talaq Ki koi charhca hai?,51,55,55,50,55,55,41,54,55,72,54,41,42,55,42,55,50,45,54,51,46,55,55,51
Duniya gol hai magar hum sab straight hai. #irony,16,16,16,16,16,16,13,17,16,23,17,13,13,16,13,16,17,12,17,16,13,16,16,16
Bhai kyu jhuti afwaahe failate ho. Paani rokna hota to rok lete Dams kabse bane huye hain yaha . Insaniyat politics se upar hoti hai.,46,52,52,48,52,52,44,59,52,79,59,44,46,52,46,52,57,42,59,46,39,52,52,46
"just remembering BOLLYWOOD : "" maine kahaa tha na team banane ke liye taaqat ki nahi neeyat chahiye hoti hai """,35,42,42,39,42,42,34,45,42,57,45,34,31,42,31,42,43,28,45,35,30,42,42,35
A. Jaspit bhumra #MissionLanka @SPN_Cricket,17,21,21,17,21,21,15,22,21,26,22,15,19,21,19,21,22,16,22,17,16,21,21,17
Yar bolna bhi nhi chahayeah. Bs dua kro sb khairiyat se hojaye r ahishta ahishta poory mulak me cricket ho,41,41,41,41,41,41,37,47,41,59,47,37,37,41,37,41,44,31,47,41,39,41,41,41
"""Sakshi Maharaj"" in logo k wajah se desh dub raha hai bs vote bank k liye kitna chutiyapa karoge politics in logo k karan badnam hai",43,45,45,43,45,45,38,50,45,68,50,38,40,45,40,45,47,35,50,43,34,45,45,43
"Triple Talaq Ban Ke Baad Kitne Musalmano Ne Danga Kiya Tha Yaad Nahi Aa Raha 10,000?? Feeling Shame  #RamRahimSingh",39,46,46,41,46,46,37,41,46,58,41,37,39,46,39,46,39,38,41,39,42,46,46,39
"Sir tet 2011 bed walo ko aap kyun nirash ker rahe, aap hi log to lok sabha me unke liye khade hue the, to a unke liye kyun politics ho rahi",53,54,54,53,54,54,45,54,54,75,54,45,43,54,43,54,53,41,54,53,40,54,54,53
"Log hamare bare me kya sochte hain, Agar yeh bhi hum hi sochenge toh phir log kya sochenge? #uberawesome #deepthought #irony",46,47,47,48,47,47,37,47,47,61,47,37,38,47,38,47,45,36,47,46,38,47,47,46
"Politician ko chodo e #MSM & #Bollywood wale kuch karne k liye  tayaar bhale gaali b b pade,sirf in logo ko paisa & controversy se MATLAB hi",45,54,54,47,54,54,40,58,54,76,58,40,44,54,44,54,58,38,58,45,36,54,54,45
"Aaj kal bollywood me do calculator ke bht charche hai.  Vimal and Roshan calculator.  Samay samay pe sahi samay pe , sahi tarah se use hota",45,48,48,45,48,48,40,49,48,68,49,40,40,48,40,48,47,39,49,45,32,48,48,45
bhai jis din tmharay politicians ghaddar hojaengay us din army politics ma ajayegi mulk bachanay . army ka kam mulk bachana hota ha,41,46,46,42,46,46,42,49,46,74,49,42,40,46,40,46,48,34,49,41,36,46,46,41
"Hubby : ""Aaj Sabji mei Namak thoda zyada lag raha hai...!""  Wife : ""Namak barabar hai...! Sabji thodi kam thi #sarcasm #wife",50,53,53,50,53,53,44,59,53,63,59,44,43,53,43,53,59,47,59,50,45,53,53,50
"#Shivji ke Naam Par #Bhaang aur #Gaanja Peene Walon,  Unhone toh Zehar Bhi Piya Tha !! #HappyHoli #sarcasm #dope #SayNoToDrugs",49,55,55,54,55,55,49,61,55,70,61,49,50,55,50,55,60,47,61,49,54,55,55,49
PTI or uske Chamaroo ka eik kaam jahan Foji dekho Chaddi neechi kar ke ultey lait jao. Yehi inki qabliyat he Politics Mei,43,47,47,43,47,47,41,53,47,65,53,41,42,47,42,47,53,37,53,43,42,47,47,43
2 ande aur ek kela de ke bolte hon medal leke aa #PaanSinghTomar #sarcasm #Irfankhan #legendary,32,39,39,35,39,39,36,47,39,47,47,36,37,39,37,39,44,31,47,32,33,39,39,32
"Beti or politics,,,,,,,Sharad Yadav-Politics,,,,,,,Din me sapne dekhna ban kare nahi to Raat kharab ho jayega,Nind bhi nahi aayegi,,,,,",60,61,61,59,61,61,41,70,61,79,70,41,55,61,55,61,67,51,70,60,50,61,61,60
Okaa ammaki abba ki puttinattainaithe ah politics tappaka chiranjeevi garini vere vishayam lo vimarsinchagalava??,35,41,41,36,41,41,30,45,41,59,45,30,33,41,33,41,45,31,45,35,31,41,41,35
Bhole bhai  politics  sadyantron ka mayajaal hai,13,17,17,13,17,17,11,15,17,22,15,11,13,17,13,17,15,12,15,13,12,17,17,13
Mai bhi badhi ho ke mithali Raj banungi or phir mihali Raj se milungi . Mujhe bhi cricket ka bohot shook hai,36,39,39,34,39,39,32,44,39,56,44,32,32,39,32,39,39,32,44,36,28,39,39,36
Ghatiya teams ke sath cricket khelkar aaoge to yahi anzham hoga.. sab glti #BCCI ki hai,32,36,36,32,36,36,33,37,36,44,37,33,31,36,31,36,36,30,37,32,27,36,36,32
OMG PART-2 kab aari hai bhagwaano ka mazak udaake paise kamana koi aapse sikhe fir baadme dharm sanskaar wali politics bhi lol.,49,48,48,50,48,48,40,55,48,73,55,40,40,48,40,48,54,37,55,49,34,48,48,49
Bachhon ki maut pe sanvedna prakat karne ki bajaye politics karne wale yahi bata raha ki tu kitna samvedanshil hai.,36,40,40,35,40,40,31,52,40,58,52,31,33,40,33,40,50,31,52,36,29,40,40,36
Saari Chori Pakdi Ja Sakti Haii  Magar Swimming Pool Mein...          Susu Karne Wale Ko Koi Nahi Pakad Sakta #Sarcasm #NaturallyHealthy,41,55,55,44,55,55,38,54,55,67,54,38,39,55,39,55,52,38,54,41,43,55,55,41
Aap logo ke jivan ki commentary achhi kar lete ho... Cricket kyu nahi try karte,24,27,27,24,27,27,22,30,27,38,30,22,20,27,20,27,27,22,30,24,21,27,27,24
Ye sahi nahi bol rahe ho aap  Is politics ke liye kyo hindu dharm ka apmaan kar rahe ho  Aapko ye sab sobha nahi deta,40,44,44,40,44,44,35,46,44,61,46,35,34,44,34,44,45,33,46,40,30,44,44,40
LOG @sachin_rt Ko Bhagwaan Kehte hai Cricket aur wo God Ghanta Kuch nahi Karta Wo Kya Koi nhi Krta..Mgr Real Farishta Hai @GautamGambhir,51,52,52,55,52,52,42,63,52,77,63,42,44,52,44,52,61,45,63,51,50,52,52,51
Modi sirf vote bank k politics k liye topi pehen k dikhawa nhi karte.. reforms k liye kam karte hain ye bahoton ko samajhna hoga..,44,45,45,45,45,45,38,51,45,70,51,38,38,45,38,45,50,35,51,44,35,45,45,44
Bank par bharosa karke hum Laakho deposit karte he... Aur wo log ek pen ko bhi thread se baandh karke rakhte he.. #sarcasm @ScreenPatti,48,48,48,49,48,48,40,55,48,74,55,40,42,48,42,48,52,42,55,48,37,48,48,48
ajeeb insaan ho tum chlo justify kroo triple talaq..chai k sath namkeen nai mila too TT. YEAH KYa chu***pa hai,44,47,47,45,47,47,35,47,47,62,47,35,37,47,37,47,50,37,47,44,39,47,47,44
Agar Tum Saath Ho @thealkayagnik @arrahman  #AlkaYagnik #Bollywood Alka Yagnik #OneConcert #MelodyLane #ARRahmanpic.twitter.com/MgCD2qFePC,60,61,61,59,61,61,49,62,61,88,62,49,53,61,53,61,61,53,62,60,58,61,61,60
Ye jo tum jaise jahil ko virasat mai milti hain na politics.....tum log ka bhi haal ram-rahim Jaisa hona chahiye,43,43,43,43,43,43,33,45,43,61,45,33,33,43,33,43,44,33,45,43,31,43,43,43
"politics saad rafique nay ki aur Nawaz nay Siyasi Shaheed keh ker, khud maar ker shaheed wahan",29,31,31,29,31,31,25,37,31,49,37,25,25,31,25,31,37,24,37,29,29,31,31,29
Are baba koi nhi rokega banwana shuru to kar faltu me bol bolkar bina mudde ko mudda kyun dete aur triple talaq aurat ke haq me h.see u book,47,54,54,47,54,54,43,59,54,75,59,43,41,54,41,54,57,40,59,47,38,54,54,47
Kar lo sir politics kar lo aap.Aaraam se time le kar poori politics keejiye sir.desh kisi aur janm mein bana lenge.abhi politics karte hain,41,47,47,42,47,47,37,53,47,72,53,37,40,47,40,47,51,35,53,41,34,47,47,41
Aye hoye ... Mullas and triple talaq par to #Freedomofpress keh ke chup thi ...,28,33,33,28,33,33,21,27,33,37,27,21,24,33,24,33,27,27,27,28,28,33,33,28
@narendramodi is bacchon ki hay lagegi  apko....koi kam ke nahi ho aap log..khali politics karte ho logo ki koi phikar nahi he.jawab do,47,52,52,47,52,52,36,57,52,74,57,36,41,52,41,52,55,41,57,47,38,52,52,47
Waho sir nic ap ka cricket ka shot bi tej aur advance rahta tha aur ab ap ki commentry aur joke bi,26,29,29,27,29,29,25,34,29,52,34,25,26,29,26,29,34,25,34,26,25,29,29,26
Humare politics ke hero ye bta do mujhe ki @Gorakhpure me Jo chote Bacho ki maut huai Hai uska jawabdehi kaun hai.kya wo desh ke future NH t,48,52,52,48,52,52,45,57,52,70,57,45,47,52,47,52,56,44,57,48,39,52,52,48
tum BC yahan bhi politics kheloge. Shame on you. Tumhari failayi gandgi hai jo aaj doosron ko saaf karni pad rahi hai. Kam kya khak hoga.,52,53,53,52,53,53,43,59,53,79,59,43,43,53,43,53,56,41,59,52,42,53,53,52
AJJ JO SAWAL / SINDH JE UNN SAKAFATI TAAREEKHI SHAHAR (MAAG) JO NAALO BUDHAYO JANHN JE NAALAY SAN BOLLYWOOD MAI FILM THAAHI WAI?,46,64,64,73,64,64,48,83,64,94,83,48,52,64,52,64,80,50,83,46,73,64,64,46
Nawaz shareef bahar k chakaar laga lay.. Floods tou atty he rehtay hain mulk mai.. #Irony #Pakistan #PMLN,39,45,45,39,45,45,36,49,45,59,49,36,38,45,38,45,45,33,49,39,34,45,45,39
And moral of the story I am reading is: kartavya se vimukh hokar shanti paana asambhav hai #irony,30,35,35,30,35,35,28,35,35,53,35,28,30,35,30,35,32,28,35,30,25,35,35,30
69 lakh de dete to aj 5 cr na dene padte...aur sabi jaan bhi bach jate...jai ho hai politics....,42,35,35,42,35,35,31,39,35,48,39,31,33,35,33,35,38,33,39,42,36,35,35,42
"Perera ko koi batao ke cricket wapis laani hai Pakistan mai, khatam naee karwani khabees shakhs.",32,35,35,31,35,35,29,39,35,51,39,29,28,35,28,35,39,28,39,32,28,35,35,32
@dhruv_rathee jisko Jankari hai wo Teri baat nahi aayege..but tuje pata hai ki Desh ke Yuva zyada politics main knowledge nahi hota..,45,50,50,45,50,50,42,56,50,71,56,42,41,50,41,50,56,40,56,45,37,50,50,45
RSS VALE HE YE UNHE KUTCH BHI FARK NHI PADTA AUR UPAR SE VAHA PER BHI POLITICS KARAGE .......YOGI,38,42,42,52,42,42,34,48,42,65,48,34,35,42,35,42,47,42,48,38,51,42,42,38
tum ny to rishwat li the aur ab khel rahy hu sharjeel tu beqasoor h tu wo q cricket say door h,33,37,37,33,37,37,30,39,37,50,39,30,32,37,32,37,41,29,39,33,31,37,37,33
"#ViruPanti @StarSportsIndia @virendersehwag  Chennai ke dosay, Delhi ke paronthay, cricket chalti hai darshakon ke bharosay",39,49,49,38,49,49,35,50,49,64,50,35,39,49,39,49,48,36,50,39,35,49,49,39
Balochistan Mein Cricket Ke Furogh Ke Liye Mazeed Stedium Banane Jahen Ge. Wafaqi Wazir-E-Parilmani Amoor.,36,41,41,40,41,41,36,46,41,58,46,36,35,41,35,41,39,35,46,36,38,41,41,36
"Woh tasweer, Zara gaur farmana.......woh tasweer lakhon mai bik gai......jisme ek bacha roti na milne per udaas tha... #UrduPoetry #irony",61,56,56,60,56,56,43,62,56,70,62,43,42,56,42,56,62,52,62,61,57,56,56,61
@MaryamNSharif jo b karo nawaz ab politics se farigh ho gaya he aur ik ne rok k dika diya ab bolo rok sako to rok lo,37,41,41,38,41,41,32,50,41,63,50,32,35,41,35,41,47,32,50,37,35,41,41,37
"Aao Cricket Match Dekhe, Rohit Ka 100 hone wala hai #INDvSL",19,22,22,22,22,22,19,27,22,31,27,19,20,22,20,22,24,17,27,19,18,22,22,19
Tumlogo ke ankhon le politicians ne parda daal rakha hai . 72 hooro ka sapna dikha ke chutiya  bana rahe hai apni politics karne keliye.,42,45,45,42,45,45,39,52,45,68,52,39,39,45,39,45,52,37,52,42,35,45,45,42
@narendramodi POLITICS SE DESH BANAAO DESH BADHAAO DESH KO DEKHO DESH KA KAAM KARO DESH PAR DHYAAN LAGAO DESH KE LIYE DRAMA KARO,41,57,57,61,57,57,45,74,57,94,74,45,48,57,48,57,69,47,74,41,58,57,57,41
Ye ha #ARYNews ki reporting???? 2sron ko ghaddar kehne wale khud #Bollywood ki lrkian dikha rhe hen...@mahboobrauf @Salman_ARYpic.twitter.com/eA2NLMXfyZ,65,64,64,66,64,64,53,76,64,95,76,53,55,64,55,64,68,58,76,65,61,64,64,65
"Rawalpindi: Pakistan Main World Eleven Cricket Team Ko Khushamdeed Kahtay Hain,Pur Aman Aur Khail Pasand Qaum Maizbani Ko Baytab Hai,DG ISPR",45,51,51,46,51,51,40,54,51,74,54,40,41,51,41,51,50,38,54,45,42,51,51,45
Lo ji @RanaAyyub aapka bhai aapki raksha karne aa gaya aaj rakhi bandhwayega kal nikah karke triple talaq dega.lekin rishta aapke layak hai,50,59,59,51,59,59,49,63,59,85,63,49,45,59,45,59,63,42,63,50,37,59,59,50
