instance,rohanrajpal/bert-base-codemixed-uncased-sentiment,Sangramsing/whisper-large,michaellee8/wisper-base-jwt,Geotrend/bert-base-15lang-cased,lesliejd/jt-whisper,racheltong/whisper-tiny,nbroad/mt5-base-qgen,AbhirupGhosh/opus-mt-finetuned-en-hi,S-Fry/large,Helsinki-NLP/opus-mt-iir-en,damerajee/hindi-english,nbroad/mt5-small-qgen,Varosa/mbart-many-to-many,aditii09/whisper_eng_asr,bitextor/bicleaner-ai-full-en-hi,patrol90/whisper-large,Helsinki-NLP/opus-mt-en-inc,setu4993/LEALLA-base,Areeb123/En-Hi_Translation_Model,rohanrajpal/bert-base-multilingual-codemixed-cased-sentiment,monsoon-nlp/muril-adapted-local,Evan-Lin/whisper-large-v1-tw,defining/maggle,rohanrajpal/bert-base-en-hi-codemix-cased
"@RandeepHooda bhai ne Ram Ram,Janamdin Mubarak ho,aur Bollywood main tagdi dhak jame bhai ki. Jai ho... #RandeepHooda",47,49,49,45,49,49,38,47,49,71,47,38,37,49,37,49,45,39,47,47,40,49,49,47
CRICKET aisi ek khel hai khelo ise akal se kohliji captain hain kab kis bowler ko layenge samajh na aaye unke shakal se.#ViruPanti #INDvAUS,49,54,54,54,54,54,47,68,54,87,68,47,49,54,49,54,64,44,68,49,42,54,54,49
"bhai abhi career pe dhyan de, politics k chakkar me aa rha hai yaar...",26,25,25,26,25,25,20,26,25,33,26,20,23,25,23,25,26,24,26,26,20,25,25,26
Zameer jinda hai ya Politics ne use bhi khaa liya...,18,19,19,18,19,19,14,19,19,24,19,14,15,19,15,19,18,16,19,18,16,19,19,18
"Kaha Fashadiya bechare babako, Sarif badmasho ka kaam nahi hai politics, uske liye tajurbe kaar badmasho ki jarrorath hai.",40,47,47,40,47,47,38,49,47,59,49,38,39,47,39,47,46,36,49,40,38,47,47,40
Aap ko national politics mai hona chahiye aap ka rujhaan delhi ki taraf jaida rahta hai,28,31,31,28,31,31,23,33,31,46,33,23,23,31,23,31,32,23,33,28,21,31,31,28
Kripya joote nikal k dhwajarohan Karen. Politics k chakkar me tirange ka apman na karen,30,33,33,29,33,33,25,32,33,44,32,25,28,33,28,33,33,26,32,30,25,33,33,30
"Tmhari Behan,Beti ko teen Talaq bol ghar se jis din bahar nikalenge tab tmhe samajh aaegi. Nd hume v pta h k Talaq Jayaz h, triple talaq nhi",54,67,67,54,67,67,52,63,67,79,63,52,50,67,50,67,61,46,63,54,48,67,67,54
2/5 woh aap.soch bhe nahi saktey kis ny kaha khi safe nahi?  pak sy cricket aalmi sazish sy khatam huwi khi say aap log khatam kar rahe ho,50,55,55,50,55,55,42,63,55,80,63,42,40,55,40,55,62,41,63,50,48,55,55,50
"@MamataOfficial ji, aapki politics par to thookane ka mann bhi nahi karta. Bengal k log kya se kya ho gaye? Shame on u",40,45,45,40,45,45,35,46,45,65,46,35,35,45,35,45,43,33,46,40,35,45,45,40
Bhai tu kisko bewkoof bana raha hai . Lagta hai Bollywood mein Sab #illiterate log hai . Abe star toh iss desh ka har nagrik hai .,45,44,44,42,44,44,41,55,44,69,55,41,41,44,41,44,53,38,55,45,38,44,44,45
@msdhoni @virendersehwag @sachin_rt  ''Room Ki Sab Deewaron Pe Photo Hai Bas Tera Tera'' <3 #Dhoni #Cricket pic.twitter.com/8HBjItZpKN,59,63,63,61,63,63,45,65,63,81,65,45,53,63,53,63,63,52,65,59,56,63,63,59
Jab ghodi langdi ho jaye to use goli maar kr laash pr politics karo. #RamRahimSentencing #Shaktimaan #MurdaKhorCongress,40,45,45,40,45,45,36,51,45,67,51,36,40,45,40,45,51,39,51,40,40,45,45,40
"@yadavakhilesh AAJ BHAKT BAHUT KHUSH HAIN KYOKI BHARAT NE AAJ CHINA SE 1962 KA BADLA LE LIYA , MODI NE TRIPLE TALAQ KO KHUD HI KHATM KR DIYA",49,63,63,71,63,63,49,80,63,100,80,49,54,63,54,63,76,52,80,49,68,63,63,49
"HALALA,TRIPLE TALAQ,CHAAR BEEWIYAN,72 HOOREIN,BESHARMI,JAHAALAT,QATL KARNE KI AAZAADI- yeh suvidhaayen kisi aur dharam mein nahin hain.",53,69,69,69,69,69,50,81,69,95,81,50,53,69,53,69,77,54,81,53,61,69,69,53
"Jaise modi ki chhori lugaai sau crore triple ralaaq se zyada hai,kis moo se triple talaq ki bat karta hai napunsak, put yr house inorder 1st",44,57,57,44,57,57,40,60,57,81,60,40,44,57,44,57,55,38,60,44,42,57,57,44
"Jitni #honesty log #Sarahah Par dikha rahe hai,Agar politics join karke vaha dikhaye..   Sach me #Desh badal ne me der nahi lagegi    #JstV4",49,57,57,49,57,57,46,56,57,74,56,46,49,57,49,57,55,45,56,49,42,57,57,49
"Kuchh log apne zimmedari nibhane se jyada , chamchagiri karke apne aap ko mahan mante hain. #Politics ,",37,42,42,37,42,42,33,48,42,61,48,33,34,42,34,42,44,33,48,37,30,42,42,37
Tere Ko politics karne ke liye aaj hi Mila tha? Apna haathi leke pehle UP mein kaam kar,28,32,32,28,32,32,24,35,32,44,35,24,26,32,26,32,36,23,35,28,24,32,32,28
Akhilesh ji kisi bhi aksmiq ghatana par bhi aap politics karane se baaz nahi aate....,32,33,33,32,33,33,24,37,33,49,37,24,27,33,27,33,34,27,37,32,21,33,33,32
Abe ab tumhe tatti pe bhi politics karni he. Hadd ho gayi yaar,23,27,27,22,27,27,19,25,27,33,25,19,21,27,21,27,24,19,25,23,18,27,27,23
Pakistan mai cricket ki wapis aney par Awam khush or pur josh hai,18,22,22,19,22,22,19,24,22,34,24,19,18,22,18,22,22,17,24,18,17,22,22,18
"Ham Aap se keh to rahe he ki Hindu-Muslim ki politics karna Modi-BJP Chhod de to 1bhi chunav nhi Jit Payege,Babri se Start ho kar abhi tak pic.twitter.com/TcirmUgkER",64,67,67,65,67,67,52,76,67,100,76,52,57,67,57,67,67,55,76,64,55,67,67,64
"Abhi ye bhi muje bathana padega politics Hai Bhai, tum sab log hamare same bhi jukthe Hai, election ke badh tum log Kya karte ho. Same.",46,49,49,46,49,49,37,51,49,71,51,37,38,49,38,49,50,38,51,46,36,49,49,46
"Politics regionalism apni jagah insaniyat jo hindustaan hain apni jagah marathi bengali bihari poorvanchali, tamil se pehle hum.insaan bane",40,50,50,41,50,50,36,59,50,75,59,36,36,50,36,50,55,34,59,40,28,50,50,40
Baraye Sharif sb tu laiey they innko chotay Sharifs ko politics mein pasaiy baanay kay liye.  Kaam hi innohnay yehi kia .,39,46,46,38,46,46,42,50,46,61,50,42,38,46,38,46,51,34,50,39,37,46,46,39
Triple Talaq pe ek chhoti si debate.. bhagoda bhakt bhaag gaya aaj tak nazar nahi aaya us post pe.,34,39,39,35,39,39,33,42,39,53,42,33,31,39,31,39,40,28,42,34,26,39,39,34
"Mera bhi ,Life bahot boring ho gayi hai @sachin_rt k retire k bad,wo maza nahi aata ab cricket k chakke chauke me.",39,43,43,40,43,43,39,46,43,63,46,39,38,43,38,43,44,34,46,39,34,43,43,39
Triple talaq bhul gaye ji,8,13,13,8,13,13,7,9,13,14,9,7,9,13,9,13,9,7,9,8,6,13,13,8
#Cricket_News:  Umar Akmal Aur Kamran Akmal Ko Har Iss Coach Se Takleef Hai Jo Inhain Na Khilai....* #WaqarYounis #AQiB_NAWAZ Nijam,49,57,57,53,57,57,45,66,57,78,66,45,47,57,47,57,61,47,66,49,56,57,57,49
"@Vjuneesh Sach bataya par ladkiyaan samajhti hein, ladkon ki gaaliyaan de kar trendy ban rahin hein #irony :)",43,41,41,43,41,41,36,48,41,61,48,36,35,41,35,41,46,33,48,43,33,41,41,43
"sabko holi par he pani ki barbaadi dikhti h ,,,, in logo ko cricket grund mei lakho ltr barbaad hone wala pani kyu nahi najar aata ??",47,49,49,47,49,49,40,57,49,73,57,40,43,49,43,49,55,38,57,47,40,49,49,47
Aur hame us ladki se jise cricket se pyaar hai...,19,18,18,19,18,18,16,19,18,29,19,16,16,18,16,18,17,17,19,19,13,18,18,19
Indian politics ko ek Alag Aur sakaratmak raah per le jaane wale  yug purush sri  Kejriwal ko hamari Aur se janamdin kee lakh lakh badhaiyan,45,47,47,44,47,47,41,57,47,74,57,41,44,47,44,47,52,39,57,45,30,47,47,45
Waqt ki rah par mera agla kadam mujhko paoge tum jaooge tum jahan meherbaan #UrmilaMatondkar #ARRahman @ashabhosle #Bollywood #dance #musicpic.twitter.com/HBLfHhaQ4V,68,76,76,69,76,76,59,81,76,99,81,59,63,76,63,76,80,61,81,68,63,76,76,68
This is politics beta .. ye ch****tia kisi aur ko bena .. Tu aur tera Chanel kis k isharoon pe chelta ha awaam seb janti ha ..,46,42,42,45,42,42,43,54,42,69,54,43,38,42,38,42,51,39,54,46,46,42,42,46
#BOLLYWOOD  Chirag Kahan Roshni Kahan | Devendra Goel | 1959,20,25,25,24,25,25,18,25,25,33,25,18,22,25,22,25,25,19,25,20,22,25,25,20
Aaoge jab tum o saajana.... #HappiestWhenSinging #JabWeMet #RashidKhan #Bollywood #Classics #Melody pic.twitter.com/10tZFBMc5t,59,56,56,57,56,56,49,61,56,78,61,49,50,56,50,56,60,50,61,59,54,56,56,59
@ajaydevgn #Mumbaikars chi pan aataa satakali #MumbaiRains #Bollywood pic.twitter.com/O8hTQ5ep0k,43,44,44,40,44,44,39,49,44,61,49,39,42,44,42,44,47,36,49,43,36,44,44,43
"01 #September  2006 Lage Raho Munna Bhai - Sanjay Dutt, Vidya Balan, Arshad Warsi.   #11YearsOfLageRahoMunnaBhai #Bollywood #nostalgiapic.twitter.com/ttRgK2D0pa",63,72,72,67,72,72,55,75,72,93,75,55,61,72,61,72,76,55,75,63,59,72,72,63
Agar kuch nahi kiya gaya population control or triple talaq pe to jarur hoga,20,29,29,22,29,29,15,22,29,34,22,15,16,29,16,29,22,18,22,20,16,29,29,20
sachin sir tumala baban chi adhvan te yet asal. Jitki utkrashta tenchi marathi lekhane hote. tetkes utkrashtra tumche cricket aahe.,45,57,57,45,57,57,42,53,57,68,53,42,43,57,43,57,55,38,53,45,38,57,57,45
Inko news channel wala Dhundhh raha  Triple talaq par Debate thha pic.twitter.com/2BnouRHNqP,33,39,39,36,39,39,28,38,39,52,38,28,30,39,30,39,36,28,38,33,33,39,39,33
@SGanguly99 sir aapnio jodi aamar saath na den tahole hoyto aami aar kono din cricket khelbo na because aamar barrir obostha khub bhalo na,48,51,51,48,51,51,52,55,51,71,55,52,46,51,46,51,56,40,55,48,38,51,51,48
#TripleTalaq sabhi sambhidhan ki najar me saman to musalman alag kaise?aazadi ke samay in logon ne Pakistan bana liya.kanoon ko mano.,46,51,51,46,51,51,42,56,51,63,56,42,42,51,42,51,52,41,56,46,34,51,51,46
BC cricket chchodo aur kuch padh likh bhi lo. Ab to US bhi tumhe bheekh dene se mana kar diya hai. Jao chaato China ki choot....,49,49,49,48,49,49,39,56,49,63,56,39,42,49,42,49,53,42,56,49,41,49,49,49
"Jale ko aag kehte hai, buje ko rakh kehte hai, vaise hi Virat Kohli ko Cricket ka Badhsha Kehte hai...!",38,38,38,38,38,38,35,47,38,59,47,35,34,38,34,38,43,36,47,38,34,38,38,38
Hindu muslim se pehle hum insan hai pareshni ke samay ek dusre ki madad kare..jo politics krte hai wo aap k kaam nahi aane wale,42,45,45,41,45,45,35,51,45,66,51,35,36,45,36,45,49,35,51,42,32,45,45,42
China cricket kyu nhi khelta?? Kyu k Technical problem hai Sab k face 1 jaise hote hai jo out ho jaye woh muh dho k phir se a sakta hai,46,44,44,46,44,44,39,54,44,75,54,39,40,44,40,44,52,41,54,46,40,44,44,46
Aur triple talaq Lene par Shauhar (suwar) se 10 guna wasoolna bhi.,24,31,31,24,31,31,21,28,31,35,28,21,22,31,22,31,27,21,28,24,22,31,31,24
Kisi or field main to hai Aap ! Aap cricket ke liye bane the or bane hai !,22,27,27,24,27,27,24,28,27,38,28,24,20,27,20,27,27,21,28,22,21,27,27,22
"Bhai ""Vande Matram"" gaya tha kya...? Yaa ""politics of appeasement"" aade aa gaya....",33,32,32,35,32,32,28,33,32,45,33,28,30,32,30,32,35,30,33,33,33,32,32,33
Dil bhaot udaas hai hamarye establishment ko politics say fursat nai mujhy dar hai kay Yeh is mulk ko shan aur Iraq bana kar chore gay,39,40,40,39,40,40,36,48,40,70,48,36,36,40,36,40,49,32,48,39,36,40,40,39
"Sahi kaha aapne, or aaj v maulana modi ji ka muslim prem dekhiye k triple talaq khatam kr rhe hn Kya mohabbat h maulana modi ji ko muslim se",49,59,59,49,59,59,40,56,59,75,56,40,40,59,40,59,55,43,56,49,36,59,59,49
Jise woh pyar karta hai Usi ko azmata hai   #irony #abound,22,24,24,22,24,24,17,26,24,28,26,17,18,24,18,24,25,18,26,22,20,24,24,22
#NowPlaying Sanam Re by Divya Khosla Kumar @valleyfreeradio #Bollywood,24,26,26,23,26,26,19,24,26,37,24,19,22,26,22,26,25,19,24,24,22,26,26,24
"ek lota triple talaq se, Oxygen ke,Badh ke Aur train hadso ke sare daag dhul gaye",27,36,36,29,36,36,28,35,36,47,35,28,27,36,27,36,33,23,35,27,24,36,36,27
aise logo ko bi kaam miljata hai jinhein cricket ki ABC ni pata aur aik hum hain jo farig bethe hain :| pic.twitter.com/zaJhMmQmlv,49,47,47,49,47,47,43,59,47,75,59,43,45,47,45,47,58,43,59,49,44,47,47,49
abhi Triple Talaq pe ban hua hai abb naqab be ban hoga,19,20,20,19,20,20,14,21,20,28,21,14,17,20,17,20,21,17,21,19,16,20,20,19
Hamare PM saab ko ye kyun samajh me nahi aata..ki aur bhi Mudde hai zamane Triple Talaq k siwa.. Hamari fikr hai to 15 lakh accnt me dedo,49,50,50,50,50,50,46,61,50,68,61,46,46,50,46,50,59,42,61,49,46,50,50,49
Bhai dedo kashmir kam se kam kashmir  be jo politics ho rahi hai vo band ho sakey aur desh ki tarak ki par jordo,35,38,38,35,38,38,33,44,38,60,44,33,34,38,34,38,41,32,44,35,29,38,38,35
"Subah subah Pakistani larne aa gaye. Border & Cricket se dil nahi bhara, ab ludo me bhi shikast chahiye inko.",36,38,38,34,38,38,35,44,38,56,44,35,33,38,33,38,40,30,44,36,28,38,38,36
#ViruPanti  TV par Sony aur  Cricket me dhoni kabhi rukte nahin,21,26,26,20,26,26,18,26,26,34,26,18,18,26,18,26,24,18,26,21,16,26,26,21
Abe chu chu triple talaq bhi gya.,12,18,18,11,18,18,8,14,18,17,14,8,10,18,10,18,14,10,14,12,9,18,18,12
"The #TripleTalaq debate with Ratan Sharda, Zeenat Shaukat Ali, Nasir Pathan Anand Narsimhan and Tanvi Shukla. pic.twitter.com/u085y4alJB",51,56,56,50,56,56,46,60,56,74,60,46,46,56,46,56,54,46,60,51,45,56,56,51
Akal nahi hai aage kya hoga sochne ki to jaake kheti karo... Politics mein aake desh lootke ghar kyu bharna hai?,42,42,42,42,42,42,37,48,42,56,48,37,35,42,35,42,46,37,48,42,32,42,42,42
Cricket News: PcB Main Mujhe Dhika Diya Gaya Hai. Mujhe PcB Ka Aaeen Banane & Election Karwane K Liye Bheja Gaya Tha. Najam Setthi,46,54,54,48,54,54,46,54,54,70,54,46,41,54,41,54,51,42,54,46,45,54,54,46
ma'm triple talaq par supreme court  ki judge ladies honi chahiye thi aurat hi aurat ko samajhti hai.waise GAURI LANKESH BHJ EK AURAT THI,44,55,55,49,55,55,43,57,55,82,57,43,43,55,43,55,54,38,57,44,41,55,55,44
"@ImranKhanPTI SHREK k phanstey he Gorey or N.SETHI Cricket bhi le aay, Mulk abad ho gya hy, NA-120 k GUTTER se DOOD ke nehrain chal pari hy,",53,60,60,58,60,60,51,69,60,86,69,51,53,60,53,60,63,51,69,53,55,60,60,53
no srk in dhoom 4 - @bollywood_life  gaytards ki akhri ummid bhi tod di isne  now gaytards be like @iamsrk tuchche 2020 tak hit dega na?pic.twitter.com/FZXn8P3y3Q,69,76,76,69,76,76,64,75,76,95,75,64,61,76,61,76,71,59,75,69,60,76,76,69
Kuch logo ko sirf politics aur religion dikhta hai.,14,15,15,14,15,15,11,16,15,26,16,11,13,15,13,15,15,13,16,14,12,15,15,14
Indian army ko kamzor samjh rahi ho tum. Sharam aa rahi hai ya nahi. Ispe bhi politics kar rahi ho. Gov nd army kamzor nahi h. Kamzor tum ho,48,57,57,49,57,57,43,59,57,79,59,43,45,57,45,57,58,39,59,48,41,57,57,48
"Sari Duniya se talak khatam kra do, apni aurat ko to apne paas bula lo,jisey bina #TripleTalaq diye chhor rakha hai,wo dusri bhi nhi kr pai pic.twitter.com/13FDa0fG72",68,71,71,70,71,71,57,84,71,96,84,57,56,71,56,71,78,58,84,68,60,71,71,68
Chinese President Tweets in Hindi KaminoTumhara triple talaq aur Ram Rahim ka topic khatam ho jaye tho meri dhamki pur bhi focus Karna,39,50,50,38,50,50,33,42,50,65,42,33,34,50,34,50,41,32,42,39,34,50,50,39
"Bollywood mein Chiffon Saree aur Baarish ka choli-daaman ka sambandh jai. Dhak-Dhak, Mr India, Aaj Rapat jaaye.",42,44,44,40,44,44,38,48,44,61,48,38,37,44,37,44,48,35,48,42,35,44,44,42
bangal me to is janam me sambhab nehi hai babu. agle janam ka kya pata? yeh gujrat punjab nehi hai bhai. bangaal hai. politics 100% hai,49,50,50,49,50,50,42,57,50,70,57,42,43,50,43,50,58,45,57,49,41,50,50,49
@iPavanTiwari Aap hi Ne Bataya She Hates Men @Mukesh7009 #sarcasm,27,29,29,28,29,29,24,31,29,36,31,24,25,29,25,29,29,25,31,27,25,29,29,27
Sab politics ka khel hai bhai,9,9,9,9,9,9,6,10,9,15,10,6,8,9,8,9,9,8,10,9,7,9,9,9
chorro sir ghar baith k tweet kar leta ya padhai jyada politics karne se yai hota hai kya jaroorat thi jane ki ?,35,43,43,35,43,43,30,47,43,59,47,30,30,43,30,43,42,30,47,35,28,43,43,35
very important day for bangladesh cricket aus ko test me haraya woh din door nahi jab bangladesh kisi khitab ko jite pic.twitter.com/qkrsDOomcv,46,47,47,47,47,47,40,53,47,78,53,40,40,47,40,47,49,41,53,46,39,47,47,46
Sir jaara is par apni party ka Stand Clear kare Doglapan na dikhaye. AAP bhi Vote bank ki Politics kar rahi hai  @ArvindKejriwalpic.twitter.com/OAvrUYFXD7,54,59,59,58,59,59,49,68,59,90,68,49,50,59,50,59,63,47,68,54,49,59,59,54
@dibyabttb isme bhi @narendramodi ka haath hoga #sarcasm,24,27,27,24,27,27,20,27,27,32,27,20,21,27,21,27,26,21,27,24,20,27,27,24
Rohit Bhai aap kuch thoda sa Mara sath batt karlo me apkebina or cricket ke  bina  bilkubhi nahe  rahe  sakta plz bhaya  mera pyara Bhai rht,48,58,58,49,58,58,44,60,58,69,60,44,39,58,39,58,59,38,60,48,39,58,58,48
Inko koi ungli kare toh civil justice law chaiye ... aur triple talaq ko rokne ke liye toh sharia law... kahan tak bhaagega,43,49,49,43,49,49,34,45,49,62,45,34,33,49,33,49,44,35,45,43,35,49,49,43
"Aisa likhne se aap ko ""ek khas dharm"" ke vote nahi milme wale aap ko aur na hi aap ki politics karne ka nazariya badal jayega. Jai Hind",47,51,51,47,51,51,38,56,51,74,56,38,41,51,41,51,53,38,56,47,35,51,51,47
Himaat nahi RSS ko flag hosting ki.chalay hai Hindu ki politics karnay.desh ko barbad kar rahi inki fake desh prem.,37,38,38,35,38,38,31,41,38,61,41,31,32,38,32,38,39,33,41,37,30,38,38,37
Ye log sab jahil hai dimaag hota toh aise kehte nhi bas ek politics lekar baith gye hain bas,30,33,33,31,33,33,26,36,33,49,36,26,27,33,27,33,37,24,36,30,26,33,33,30
Kuch apni politics ka bachav kar rahe hai kuch apne karmo ka... Yatriyo ka bachav kon kar rha hai,35,34,34,35,34,34,29,41,34,48,41,29,27,34,27,34,40,32,41,35,32,34,34,35
Kuch logo ka number iss liye save krte hain ki galti se uth naa jaye.... #sarcasm @vyasishit @shubham_14994 @_raj_parmar_ @the_adson,55,55,55,55,55,55,49,62,55,76,62,49,50,55,50,55,59,51,62,55,49,55,55,55
"zee news ke paas dusra topic nahi kya triple talaq ke alawa, unemployment aur mahengayee par kab debate karoge",31,40,40,32,40,40,29,39,40,55,39,29,32,40,32,40,38,28,39,31,28,40,40,31
"Ye dramebaz, Shi cheez k liye to anshan Krte nhi, dum h to triple talaq k khilaaf kregi anshan Circus h aap",39,47,47,37,47,47,34,47,47,58,47,34,33,47,33,47,45,31,47,39,35,47,47,39
Ye Politics ki Qandeel Baloch (QB). Anjam bhi lagta hai waisa hi ho ga is be-zameer aurat ka.,34,36,36,34,36,36,31,39,36,51,39,31,32,36,32,36,37,31,39,34,32,36,36,34
Sahi kaha bhai ab inpe se bhi visvash uth gya ab god pe bharosa hai.... Ab kisi bhi party ko vote nhi deni all politics party,45,42,42,45,42,42,31,49,42,65,49,31,36,42,36,42,47,38,49,45,34,42,42,45
Idantha kaadu mahesh katthi gadu lauda asalu politics gurinchi matladuthu madhyalo mahesh babu pawan kante star antadu endi,38,45,45,39,45,45,34,51,45,65,51,34,33,45,33,45,51,30,51,38,31,45,45,38
Latestt!! @thealkayagnik  #AlkaYagnik #Bollywood Alka Yagnik #MelodyLane #LucknowCentralpic.twitter.com/0gmJE8Sc49,52,54,54,52,54,54,42,55,54,75,55,42,44,54,44,54,54,45,55,52,46,54,54,52
"Kya bibi, abhi tak tenu yad na aayo, soyi thi kya ? Jaise hi Triple Talaq ki lag gayi, tereko Modi ji ke biwi ki yad aa gayi.",46,55,55,47,55,55,44,60,55,70,60,44,46,55,46,55,55,42,60,46,41,55,55,46
"Wahan border pe jawan lad rahe hain, aur Sansa-Arya; Cersie yahan politics kar rahi hain @kunalkamra88 @SnGComedyIN @BollywoodGandu",48,51,51,47,51,51,42,54,51,77,54,42,45,51,45,51,54,40,54,48,40,51,51,48
"WICKET - Dikshanshu Negi c Kazi b Sarfaraz Ashraf 15(25) Bijapur Bulls 63/4 (12.1), Bijapur Bulls need 99 in 47 balls  #NSvBIJ #Cricket",50,58,58,54,58,58,43,58,58,81,58,43,50,58,50,58,54,47,58,50,45,58,58,50
Pakistan Main Cricket Wapas Aayi Hai. To Ye Sub K Liye Khushi Ki Baat Hai. Mere Waqt Main Pakistan Main Muqabile Buhat Sakht Hote The. Tahir,45,50,50,45,50,50,40,51,50,72,51,40,36,50,36,50,49,38,51,45,45,50,50,45
@NitishKumar bas tum hi ek sabse budhiman ho.. baaki sabto chutiye hain politics me,30,32,32,31,32,32,25,35,32,47,35,25,27,32,27,32,36,26,35,30,23,32,32,30
Aashiyaane ki baat karte ho Dil jalane ki baat karte ho #Sarcasm in gazals,26,27,27,26,27,27,23,36,27,42,36,23,23,27,23,27,35,21,36,26,23,27,27,26
Ye Brathwaite hum se bhi out nai hota tha UAE main @ECB_cricket,23,27,27,22,27,27,18,26,27,35,26,18,22,27,22,27,26,18,26,23,19,27,27,23
"*Chinese President Tweets in Hindi* ""Kamino..Tumhara triple talaq aur RamRahim ka topic khatam ho jaye tho meri dhamki pur bhi focus Karna",45,55,55,44,55,55,38,48,55,72,48,38,41,55,41,55,46,38,48,45,41,55,55,45
Bhai politics ma koi b yakeen ke kabil nahi..IK pr aik umeed ha last agr ab vo nahi tu maro corrupt leaders se pyar karo aur khar roz maro,45,47,47,45,47,47,40,56,47,70,56,40,40,47,40,47,54,39,56,45,42,47,47,45
"Itani trains patari se utar rahi hai, sudharna nahi hai to seat belt hi lagwa do #sarcasm @RailMinIndia",32,39,39,34,39,39,32,41,39,56,41,32,35,39,35,39,40,32,41,32,32,39,39,32
Maine poocha Ghazwa e hind kya hai?? Apke triple talaq aur halala se mera koi matlab nahi Apke ghar ki auratein hai chahe jo karo,42,51,51,44,51,51,38,54,51,70,54,38,37,51,37,51,52,38,54,42,38,51,51,42
RT @ChiratJholi: @MLK ki punchkula ki safalta ko dekhte huye defence minister banana chahiye @PMOIndia @narendramodi #Sarcasm,45,48,48,45,48,48,40,52,48,69,52,40,41,48,41,48,47,37,52,45,35,48,48,45
Abe madarjaat...Khud ke ma tak ko tu na chode...bos d k tu bachon k maut pe bhi politics kar raha hai....,43,43,43,42,43,43,31,42,43,49,42,31,34,43,34,43,45,38,42,43,39,43,43,43
feel for them yaar.. badd se badtar hote jaa rhi hai inki cricket,22,24,24,22,24,24,20,24,24,34,24,20,23,24,23,24,23,21,24,22,18,24,24,22
Triple Talaq Muslim Samaj ke Purushon ke Hawas ka Intizam tha..,21,24,24,20,24,24,18,24,24,34,24,18,21,24,21,24,24,19,24,21,19,24,24,21
"@suyashrajd Roti jal gayi hai, par khana achchha hai! ;) #Sarcasm",27,27,27,27,27,27,27,34,27,37,34,27,28,27,28,27,33,25,34,27,25,27,27,27
@ShazaFK agr ap waiqi insaniyt  k liye #KPK gae ho to..... phir elaaj he kro.... ye elaaj k naam pe politics q kr rahay ho????,57,49,49,55,49,49,45,66,49,74,66,45,44,49,44,49,64,50,66,57,53,49,49,57
Saala. Idhar Whatsapp chalu hai aur baat karneko koi nahi. #irony,23,25,25,24,25,25,20,29,25,32,29,20,19,25,19,25,29,18,29,23,18,25,25,23
@AliQuliMirzaAQM triple talaq ke liye bhi kuch karo Sir,19,30,30,22,30,30,16,25,30,30,25,16,17,30,17,30,25,19,25,19,18,30,30,19
Maulvi sahab Keh rahe hai #TripleTalaq galat hai lekin hota rahega,24,27,27,25,27,27,20,30,27,36,30,20,20,27,20,27,29,22,30,24,19,27,27,24
Insaan sochta kuchh hai bolta kuchh hai aur likhta kuchh aur hai I think you got it #cricket,29,34,34,30,34,34,25,40,34,48,40,25,28,34,28,34,39,25,40,29,26,34,34,29
Modi ji ek bullet train ajmer se bhi Chalwa do taki Bollywood ke sitaron ko Dargah or pushkar aane ki sahuliyat ho jaye,37,44,44,36,44,44,34,46,44,62,46,34,33,44,33,44,44,32,46,37,31,44,44,37
"Ab Kanoon Badalne Me Apni Wah Wah Karwaana Chahte Hain, 2019 Ka Prachaar Suru Ho Chuka Hai, Triple Talaq, Ab Raksha Mantri, Aage....????????",55,50,50,59,50,50,41,60,50,80,60,41,45,50,45,50,60,53,60,55,54,50,50,55
@bollywood_life Vaani Kapoor pehle bhi model thi aur ab Bhi model ban kar hi reh gayi hai,29,32,32,28,32,32,23,33,32,50,33,23,24,32,24,32,34,25,33,29,22,32,32,29
#TripleTalaq   Aaj kai modi virodhi achhe se so nai paege..,20,28,28,21,28,28,21,30,28,31,30,21,22,28,22,28,28,20,30,20,18,28,28,20
Mujh pr muhtarma Q jo politics apni mafad k liye karte hain hilal aur haram ka fark nahi jante half lene se pehly jo wade karte han nibate n,48,50,50,48,50,50,41,61,50,80,61,41,40,50,40,50,59,39,61,48,42,50,50,48
Sach aur jhooth ke beech ek teesri cheez aati hei: POLITICS,21,26,26,25,26,26,21,28,26,34,28,21,20,26,20,26,29,21,28,21,18,26,26,21
Ye Manubad Bramman Bad and jati bad khatam ho.tabhi ye corruption khatam hoga.barna jati bad k naam pad ye gandi politics chalte rahega.,43,48,48,44,48,48,38,50,48,73,50,38,42,48,42,48,48,37,50,43,37,48,48,43
"'Tujhe dekha to yeh jana sanam......."" PART 1 #DDLJ #SRKajol #SRK #TheBestOfSRK #Bollywood pic.twitter.com/23pUGfLx3z",62,63,63,64,63,63,43,63,63,74,63,43,49,63,49,63,59,55,63,62,58,63,63,62
"WICKET - AM Kiran c Anirudha Joshi b Sarfaraz Ashraf 3(6) Bijapur Bulls 80/5 (14.1), Bijapur Bulls need 82 in 35 balls  #NSvBIJ #Cricket",51,58,58,54,58,58,45,57,58,79,57,45,51,58,51,58,55,47,57,51,45,58,58,51
Chutiya site hai bc @bollywood_life RTs ke liye har jagah baap ka nam jarur lete hai ye log,33,33,33,33,33,33,27,39,33,50,39,27,28,33,28,33,38,26,39,33,24,33,33,33
Bilkul hai jab akhilesh cricket khelta tha tab kisi ko apatti nahi thi youva cm ka naara lagta tha jab yogi gai ko chana khilaye sab ko dard,46,55,55,46,55,55,42,56,55,78,56,42,42,55,42,55,57,41,56,46,38,55,55,46
.#Bollywood #Hollywood mey farak hai,14,15,15,10,15,15,9,13,15,24,13,9,13,15,13,15,15,9,13,14,9,15,15,14
Yee raa Yuvametha politics ki sanyasam teesukuntaada,17,21,21,18,21,21,16,21,21,30,21,16,19,21,19,21,19,13,21,17,15,21,21,17
"Cricket News: Pakistan Main Acha Waqt Guzaar Rahe Hain. Shaiqeen Buhat Ache Hain. Wicket Buhat Achi Thi. Hashim Amla - ""Zaheer_Rajper""",49,57,57,49,57,57,47,56,57,74,56,47,43,57,43,57,52,42,56,49,50,57,57,49
"Muslims ko Salam,Triple Talaq ka Judgement Against Aane k Bad Bhi Shanti Banaye Rakhne k Liye Shukriya #babaramraheem",38,44,44,37,44,44,34,42,44,59,42,34,37,44,37,44,39,33,42,38,33,44,44,38
Cricket News:  Dhamake Ki Gnonj K Baad Abdul Razzaq Ne Kabul Se Wapasi Ka Faisla Kar Liya...!! ?_ Rept:Nadeem Umrani,42,47,47,44,47,47,40,51,47,61,51,40,38,47,38,47,47,42,51,42,45,47,47,42
.@Fussy_Ca bc! Muth marke ye sperm maar rahe hai aur bol rahe hai non violence #irony  pic.twitter.com/1oiEViDtFu,44,47,47,48,47,47,44,54,47,69,54,44,39,47,39,47,51,41,54,44,42,47,47,44
hahhaahha.. dekho jara.. ye triple talaq ka virodh karne wale uncle hain.. aur yaha ab gyan denge,36,42,42,36,42,42,34,42,42,54,42,34,35,42,35,42,42,31,42,36,29,42,42,36
Is point per aap log kab tak politics kartay Raul gay . Eik taraf bhutto nahee mara abhee tak aur aap logo kee fazool bakwas,39,43,43,38,43,43,35,50,43,69,50,35,36,43,36,43,50,32,50,39,34,43,43,39
Aisay buddhe sehri main cricket khelte hue pareshan karte hain neend kharab kartay ho sonay do inse pura area pareshan hota hai,39,44,44,39,44,44,35,46,44,66,46,35,34,44,34,44,46,33,46,39,32,44,44,39
Chal ad bana ke dekha #realbanao #advertising #Millennials #BiggBossTamil #videomarketing #selfie4fandom #Bollywood pic.twitter.com/QW1cu7jnVX,54,63,63,54,63,63,41,63,63,85,63,41,51,63,51,63,66,46,63,54,49,63,63,54
"TUTI Patriots 110/3 (15.0), Karthik 13(14), SP Nathan 11(7), Last Wkt Abhinav Mukund c Sathish b Arun Kumar 41(38)  #TPvCSG #Cricket",59,57,57,55,57,57,43,60,57,77,60,43,48,57,48,57,60,52,60,59,53,57,57,59
